id,page,bbox,text_length,text,aurora,OSDG,combined,sentiment
3490,page 42 of ../pdf/generalmills.pdf,"(54.279998779296875, 441.8439025878906, 380.18206787109375, 530.10986328125)",112,"*For fiscal 2018 and 2019, some data differ compared to prior reports due to changes in methodology (% of  noncompliances resolved are reported based on the number of findings rather than the number of suppliers with  findings) as well as improvements in data collection and accuracy. **Of noncompliances identified for owned manufacturing locations in fiscal 2020, 36% related to human rights and  64% related to health, safety and environment. ***As of December 2020.  ****Of noncompliances identified for co-packers in fiscal 2020, 30% related to human rights and 70% related to  health, safety and environment. *****Of noncompliances identified for Tier 1 direct suppliers in fiscal 2020, 100% related to health, safety   and environment. ",,,,0.9042
3586,page 43 of ../pdf/generalmills.pdf,"(428.7804260253906, 148.65530395507812, 563.5858764648438, 241.32130432128906)",47,"In 2020, General Mills launched a  three-year pilot in Western Michigan  to advance regenerative principles  at dairies that produce fluid milk  for our yogurt products, including  Yoplait. The pilot provides dairy  farmers education and coaching to  implement regenerative practices such  as growing and using for feed diverse  ",['SDG_4'],['SDG_4'],['SDG_4'],0.296
3587,page 43 of ../pdf/generalmills.pdf,"(576.109375, 148.65530395507812, 709.1588134765625, 230.82130432128906)",45,"mixtures of crops, to support both soil  and animal health. Working with the  University of Wisconsin-Madison and  Cornell University, we are collecting a  comprehensive set of animal metrics  with the goal of understanding cow  health and welfare as an integral  part of the dairy ecosystem.  ",,,,0.5719
3711,page 44 of ../pdf/generalmills.pdf,"(594.5364990234375, 374.8930969238281, 735.7544555664062, 500.5351257324219)",33,"In fiscal 2020, we  completed 10 energy  efficiency and reduction  projects across the  company. In total, these  projects saved 8.6 million  kWh of electricity and  avoided 9,183 metric tons  CO₂e of GHG emissions. ",,,,0.6124
3725,page 45 of ../pdf/generalmills.pdf,"(262.7119140625, 83.45362091064453, 376.6852722167969, 134.11961364746094)",20,"In fiscal 2020, General Mills rose  to No. 38 on the Top 100 list of  the EPA  Green Power  Partnership. ",,,,-0.1027
3796,page 45 of ../pdf/generalmills.pdf,"(601.4734497070312, 342.9742736816406, 715.9165649414062, 425.1402893066406)",35,"We participate in numerous  initiatives to decrease food  waste in operations and beyond,  such as the U.S. Food Waste  Challenge, Friends of Champions  12.3 and Consumer Goods  Forum Food Waste Coalition  of Action. Learn more.   ",['SDG_12'],['SDG_12'],['SDG_12'],-0.1531
3797,page 45 of ../pdf/generalmills.pdf,"(601.4174194335938, 432.9732666015625, 710.3929443359375, 483.6392822265625)",25,"In fiscal 2020, 4.6% of our total  production volume was food  waste,** and only 0.54% of that  (0.025% of total production  volume) went to disposal.  ",['SDG_12'],,['SDG_12'],0.0
3822,page 45 of ../pdf/generalmills.pdf,"(77.88639831542969, 364.37530517578125, 217.96209716796875, 467.54132080078125)",61,"In June 2017, General Mills signed a 15- year virtual power purchase agreement  with Renewable Energy Systems (RES)  for 100 megawatts of the Cactus Flats  wind project in Concho County, Texas. In  fiscal 2020, this project generated RECs  equivalent to approximately 1,205,596  GJ of electricity for General Mills, about  33% of electricity usage at our owned  manufacturing locations in the U.S.  ",,['SDG_7'],['SDG_7'],0.8415
3823,page 45 of ../pdf/generalmills.pdf,"(78.21539306640625, 473.3722839355469, 217.9893341064453, 513.5382690429688)",24,"In April 2019, we announced a 15-year  virtual power purchase agreement with  Roaring Fork Wind, LLC, a joint venture  partnership between RES and Steelhead  ",,,,0.4939
3824,page 45 of ../pdf/generalmills.pdf,"(77.6134033203125, 515.372314453125, 216.82940673828125, 555.538330078125)",24,"Americas, for 200 megawatts of its  Maverick Creek wind project. Located in  central Texas, the project will produce  RECs for General Mills that, together  ",,,,0.0
3825,page 45 of ../pdf/generalmills.pdf,"(227.53941345214844, 364.37530517578125, 360.1194152832031, 436.04132080078125)",34,"with the Cactus Flats wind power  agreement, are calculated to equal  100% of the electricity used annually   at the company’s owned U.S. facilities.  The Maverick Creek wind project   began commercial generation in  November 2020. ",,['SDG_7'],['SDG_7'],0.4939
3870,page 46 of ../pdf/generalmills.pdf,"(72.12739562988281, 454.1872863769531, 212.6033935546875, 557.353271484375)",60,"In early 2021, we launched the first store  drop-off recyclable snack bar wrapper,  for our Nature Valley bars coupled with  a consumer education campaign on  how to recycle them. Wrappers recycled  through store drop-off programs are  turned into new materials like composite  lumber. To encourage adoption of this  technology and accelerate the benefits  of scale, General Mills has decided to  ",['SDG_4'],,['SDG_4'],0.836
3871,page 46 of ../pdf/generalmills.pdf,"(226.6383819580078, 454.1872863769531, 370.14544677734375, 504.8533020019531)",28,"not pursue a patent. We urge others  in the industry to develop recyclable  solutions, including polyethylene-based  designs that can be certified for recycling  within the store drop-off program. ",,,,0.1779
3879,page 46 of ../pdf/generalmills.pdf,"(567.0, 425.41387939453125, 693.7412719726562, 476.07989501953125)",27,"By converting to a renewable, bio- based plastic film for Cascadian  Farm cereal box liners, we will  use 270 METRIC TONS less of  nonrenewable virgin plastic annually.  ",,,,0.0
3882,page 46 of ../pdf/generalmills.pdf,"(567.0, 490.93389892578125, 718.47998046875, 552.0999145507812)",31,"Through our contributions to  The Recycling Partnership, we’ve  supported their efforts to divert more   than 230 MILLION POUNDS of recyclables  from landfills into the recycling stream over   the past six years. ",,,,0.3182
3885,page 46 of ../pdf/generalmills.pdf,"(415.6180114746094, 199.99290466308594, 719.2738037109375, 243.4638671875)",21,"Packaging ambition: By 2030, all  General Mills brands will design  100% of packaging to be recyclable  or reusable. Learn more. 88% ",,,,0.0
3886,page 46 of ../pdf/generalmills.pdf,"(567.0, 303.13720703125, 678.2503662109375, 353.9642028808594)",21,"In 2020, 100% of our fiber  packaging was from sustainable  sources, using either recycled  materials or virgin wood fiber,  avoiding deforestation. ","['SDG_9', 'SDG_15']",,"['SDG_15', 'SDG_9']",-0.34
3887,page 46 of ../pdf/generalmills.pdf,"(415.6180114746094, 303.13720703125, 547.3021240234375, 353.9642028808594)",30,Sourcing: General Mills has a target to  source 100% of our fiber packaging  by 2020 from recycled material or  from virgin wood fiber regions that  do not contribute to deforestation. ,,,,0.0
3894,page 46 of ../pdf/generalmills.pdf,"(54.0, 579.8489990234375, 749.4127807617188, 587.114990234375)",35,"*We use the following materials in our global packaging: fiber (58% of finished product packaging material by weight, including product and transportation packaging), steel (21%), plastic (15%), composite cans (3%), glass (2%), and aluminum (1%). ",,,,0.0
3895,page 46 of ../pdf/generalmills.pdf,"(53.996742248535156, 301.8518981933594, 207.95054626464844, 409.8987121582031)",49,"v In 2019, Annie’s  became the first  major brand  in the U.S. to  commercialize  recycled content  in a cereal liner,  using at least 35%  postconsumer recycled plastic. And more  than 90% of cereal liners in General Mills  U.S. bag-in-box portfolio are recyclable by  volume (pounds and reported net sales). ",,,,0.0
3896,page 46 of ../pdf/generalmills.pdf,"(230.12905883789062, 293.23187255859375, 387.36676025390625, 410.27593994140625)",45,"v In December  2020, energy  company Total,  plastic converter  Intraplás and  Yoplait announced  successful  completion of a  pilot using certified  chemically recycled polystyrene in yogurt  pots. This is the first step of a collaboration  aimed at supporting the development of  sustainable polystyrene recycling in France. ",['SDG_9'],,['SDG_9'],0.8316
3899,page 47 of ../pdf/generalmills.pdf,"(347.739990234375, 473.7315979003906, 575.2720947265625, 562.0791015625)",20,"Our global total injury rate was  0.85 injuries per 100 employees  in fiscal 2020, significantly  below food-industry averages.  0.85 50% ",,,,-0.4215
3979,page 48 of ../pdf/generalmills.pdf,"(53.82720184326172, 450.6799011230469, 713.5974731445312, 476.0599060058594)",27,"General Mills received numerous awards in 2020.* Listed below are a few of these recognitions, illustrating our commitment to being an  employer of choice for all employees. ",,,,0.6808
3982,page 48 of ../pdf/generalmills.pdf,"(247.71121215820312, 173.40969848632812, 378.1562805175781, 213.57569885253906)",22,"Protecting the health, safety and well- being of our people around the world  with workplace safety precautions,  flexible work options and benefits. ",,,,0.8807
3983,page 48 of ../pdf/generalmills.pdf,"(409.523193359375, 173.40969848632812, 551.72802734375, 234.57569885253906)",25,"Supporting our communities globally  through grants, food donations (including  our manufacture-to-donate initiative),  employee volunteerism and giving   (see the Community section of this   report for details). ",,,,0.7351
4099,page 49 of ../pdf/generalmills.pdf,"(70.22129821777344, 528.5423583984375, 609.164794921875, 568.3098754882812)",20,"Effectively mitigate risks  and remedy harm through  stakeholder engagement, taking  action and tracking progress ASSESS INTEGRATE ACT AND TRACK COMMUNICATE ",,,,0.4767
4351,page 51 of ../pdf/generalmills.pdf,"(248.61318969726562, 486.69378662109375, 535.8855590820312, 558.3598022460938)",71,"During the pandemic, we implemented an enterprise-wide response to ensure  employee safety. In our manufacturing facilities, we were an early adopter of social  distancing protocols, temperature checks, enhanced sanitation, mask use, and other  protective equipment and practices. Our layered protections, combined  with robust contact tracing and exclusion protocols, helped to prevent  the virus from spreading within our facilities. Our office staff has shifted  primarily to working remotely as global conditions dictate.  ",['SDG_10'],['SDG_3'],"['SDG_10', 'SDG_3']",0.6908
4355,page 51 of ../pdf/generalmills.pdf,"(593.1048583984375, 492.6361083984375, 735.6209106445312, 535.4066772460938)",20,"Our global lost-time injury  frequency rate was 0.36 injuries per  100 employees in fiscal 2020, down  from 0.40 in 2019. ",,,,-0.4215
4358,page 51 of ../pdf/generalmills.pdf,"(593.0, 546.1021728515625, 718.4779663085938, 577.3621826171875)",21,"Global incident data includes all General  Mills owned/operated facilities, including  Yoki and Yoplait International, Häagen-Dazs  shops, Blue Buffalo and global offices.  ",,,,0.0
4407,page 52 of ../pdf/generalmills.pdf,"(243.8345947265625, 352.8192138671875, 380.5863952636719, 435.1462097167969)",43,Our commitment: We will direct our  philanthropy to work locally and  nationally with food banks and anti- hunger organizations to address food  insecurity that disproportionately  impacts communities of color. See our  actions in the Community section of this  report. Photo credit: Feeding America ,['SDG_2'],,['SDG_2'],-0.2263
4408,page 52 of ../pdf/generalmills.pdf,"(400.9700012207031, 352.8192138671875, 548.2710571289062, 424.6462097167969)",48,"Our commitment: Box Tops for  EducationTM will build on its legacy of  giving nearly US$1 billion to schools, with a  renewed focus on creating greater equity  in education for kids of color so they can  reach their full potential. Learn more in the  Community section of this report. ",['SDG_4'],,['SDG_4'],0.9074
4415,page 52 of ../pdf/generalmills.pdf,"(553.239990234375, 548.3221435546875, 737.5714721679688, 584.3372192382812)",26,CULTURAL INCLUSION: Ensure an inclusive culture  that encourages all employees around the world to  share their unique perspectives and ideas in a safe and  respectful environment ,,,,0.9118
4416,page 52 of ../pdf/generalmills.pdf,"(553.239990234375, 493.96429443359375, 733.2935180664062, 529.9793090820312)",32,"WORKFORCE INCLUSION: Ensure we recruit, retain,  develop and advance a workforce that reflects the  diversity of the consumers we serve in our markets  around the world at all levels of the organization ",,,,0.3818
4417,page 52 of ../pdf/generalmills.pdf,"(229.5, 548.3221435546875, 400.3280944824219, 593.3392333984375)",31,CONSUMER INCLUSION: Ensure our brands and  products consider the needs of an increasingly  diverse consumer and customer base around the  world while creating consumer messages that are  respectful of that diversity ,,,,0.7783
4418,page 52 of ../pdf/generalmills.pdf,"(229.5, 493.96429443359375, 406.9259033203125, 529.9793090820312)",23,"SOCIETAL INCLUSION: Ensure our external  impact is inclusive of diverse communities in our  markets around the world through philanthropy,  volunteerism and social good ",['SDG_10'],,['SDG_10'],0.6705
4424,page 52 of ../pdf/generalmills.pdf,"(68.95999908447266, 353.1609191894531, 197.42263793945312, 487.9879150390625)",66,"Our goal is to foster a culture of  inclusion and belonging that allows  all our employees to thrive. Ensuring  diversity of input and perspectives  is core to our business strategy.   We actively cultivate a culture   that acknowledges, respects and  values all dimensions of diversity –   including gender, race, sexual  orientation, ability, backgrounds  and beliefs. We are committed  to advancing racial equity within  and outside our workplace.  ",,,,0.8957
4425,page 52 of ../pdf/generalmills.pdf,"(68.95999908447266, 494.16192626953125, 186.07630920410156, 576.4888916015625)",37,"Our strategy: Using our global  inclusion framework, we will  advance engagement around the  world, leveraging data to assess  progress and hold ourselves  accountable as we continue to  foster a culture of inclusion and  belonging at General Mills. ",,,,0.7003
4437,page 53 of ../pdf/generalmills.pdf,"(72.2771987915039, 558.5897216796875, 365.35888671875, 572.4661254882812)",28,*Source: Based on a a study done by the Center For Talent Innovation in 2019 on Being Black in Corporate America.  **Senior Leadership Team includes CEO's direct reports. ,,,,0.6597
4440,page 53 of ../pdf/generalmills.pdf,"(567.6248168945312, 418.27880859375, 706.3080444335938, 551.3088989257812)",64,"Back in 1991, General Mills worked  with the community to create and  host the first annual Dr. Martin Luther  King Jr. Holiday Breakfast. This  community-wide event held in  Minneapolis and now attended by  thousands of people annually  celebrates the life and legacy of  Dr. King while raising money for the  United Negro College  Fund (UNCF) to help  Black students get to  and through college. ",,,,0.9186
4458,page 53 of ../pdf/generalmills.pdf,"(217.535400390625, 171.62588500976562, 367.82440185546875, 222.98460388183594)",27,"Our foundation provided $400k in  quick response grants to help heal,  rebuild and nourish the community  in the wake of the George Floyd  tragedy and civil unrest. ",,,,-0.2023
4459,page 53 of ../pdf/generalmills.pdf,"(71.96330261230469, 242.99588012695312, 200.60411071777344, 304.69085693359375)",21,We've made our allyship  resources publicly available  at www.generalmills.com/ allyship to help organizations  create a culture of belonging  for marginalized communities. ,,,,0.5859
4462,page 53 of ../pdf/generalmills.pdf,"(390.9002990722656, 198.88851928710938, 535.625732421875, 259.62579345703125)",27,"3,500+ employees globally attended the  George Floyd Courageous Conversation to  reflect and engage on how to play a role in  racial justice and social equity. 325+ employees ",,,,0.891
4463,page 53 of ../pdf/generalmills.pdf,"(390.85430908203125, 257.02569580078125, 540.5068359375, 314.3046569824219)",40,"Over 325 employees volunteered to  assemble 10,000 snack, hygiene and  cleaning supply community kits for the  YWCA of Minneapolis, Hallie Q Brown, Kids  in Need and the Keystone Community  Center who are addressing immediate needs  in Minneapolis and St. Paul.  ",,,,0.0
4559,page 54 of ../pdf/generalmills.pdf,"(404.4599914550781, 308.17919921875, 554.0484008789062, 398.23150634765625)",55,"r The 2020 Dr. Martin Luther King Jr.  Holiday Breakfast in Minneapolis, hosted  by General Mills, featured former U.S.  Attorney General Eric Holder as keynote  speaker. Pictured from left: Aiesha  Dempster, event chair and General Mills  external supply chain director; Holder;  Laverne McCartney Knighton, UNCF area  director; and Kofi Bruce, General Mills  chief financial officer.  ",,,,0.4019
4561,page 54 of ../pdf/generalmills.pdf,"(244.17221069335938, 451.135498046875, 522.567138671875, 522.801513671875)",83,"We believe leadership advocacy and support of our inclusion efforts are critical  to creating the culture we strive to have. Each of our senior leaders is responsible  for creating inclusion plans for their respective organizations and ensuring their  talent pipelines reflect the diversity of our consumer base. Our Chief Executive  Officer and Chief Human Resources Officer review inclusion progress throughout  the year, including during our senior-level talent reviews. Our management team  also supports our inclusion efforts as the sponsor of our employee networks.  ",,,,0.9633
4562,page 54 of ../pdf/generalmills.pdf,"(231.5, 159.17189025878906, 563.2732543945312, 177.2461395263672)",20,"r REAL is a framework to help people apply the principles of effective allyship all the time,   in any situation.  ",,,,0.7003
4572,page 55 of ../pdf/generalmills.pdf,"(81.81220245361328, 290.7026062011719, 700.9447631835938, 299.58612060546875)",24,White W Asian A Black or African American B Hispanic or Latino L Native Hawaiian or Pacific Islander NH Two or more races T ,,,,0.6037
4575,page 55 of ../pdf/generalmills.pdf,"(128.5850830078125, 162.05038452148438, 722.7188110351562, 184.31741333007812)",22,A: 6% A: 8% A: 6% A: 7% A: 4% B: 5% B: 6% B: 17% B: 5% B: 3% B: 5% ,,,,0.0
4673,page 56 of ../pdf/generalmills.pdf,"(54.0, 582.0538940429688, 519.6417846679688, 598.3198852539062)",42,"*Diverse suppliers are defined as businesses 51% owned and operated by racial minorities, women, veterans, and disabled and LGBTQ+ individuals. **Our program expansion targets women-owned businesses globally, in addition to providing our full support to all recognized diversity groups in North America. ",,,,0.4019
4674,page 56 of ../pdf/generalmills.pdf,"(580.5, 518.4019165039062, 732.4874267578125, 563.4678955078125)",28,r We brought together groups of diverse  suppliers for development and networking  during our annual holiday gathering. More  than 300 suppliers participated – our  highest attendance to date.  ,,,,0.4019
4675,page 56 of ../pdf/generalmills.pdf,"(286.1199951171875, 446.181884765625, 390.0268859863281, 572.22314453125)",49,"v As part of our global  supplier diversity  program, we introduced  a Supplier Diversity  Award to recognize  diverse businesses in  2020. In keeping with our  commitment to support  women’s empowerment and  focus on women-owned  businesses in our supply  chain, the 2020 award  winner was Kenco, a valued  warehousing partner. ",,,,0.9584
4753,page 57 of ../pdf/generalmills.pdf,"(69.4188003540039, 369.476806640625, 189.7786865234375, 409.642822265625)",22,"n   Enhanced resources to support  healthy habits and mental well- being, so employees and their  families never have to go it alone ",,,,0.6705
4756,page 57 of ../pdf/generalmills.pdf,"(240.27999877929688, 408.4538879394531, 549.4837646484375, 432.5919189453125)",21,Learn more about our actions to support employees and communities  during COVID-19 here and in the Community section of this report.  ,,,,0.4019
4757,page 57 of ../pdf/generalmills.pdf,"(405.4187927246094, 286.976806640625, 550.7735595703125, 337.642822265625)",23,"n   Focused on care, flexibility and  prioritization to manage through  uncertainty, including flexible schedules  and work-from-home arrangements for  employees who could work remotely ",,,,0.7717
4761,page 57 of ../pdf/generalmills.pdf,"(580.538818359375, 286.976806640625, 725.1895141601562, 327.142822265625)",20,n   Additional US$500 match from the  General Mills Foundation for employees  who participate in the company’s  charitable gift matching program ,,,,0.6808
4783,page 58 of ../pdf/generalmills.pdf,"(70.71760559082031, 213.29190063476562, 180.36480712890625, 272.9798889160156)",21,"We encourage good  nutrition, offer employees  healthy dining choices and  programs at our facilities,  and provide opportunities  to increase physical activity.  ",,,,0.9153
4785,page 58 of ../pdf/generalmills.pdf,"(65.68479919433594, 97.4057846069336, 706.1238403320312, 120.30179595947266)",38,We believe that providing wellness opportunities for our employees and their families is crucial to upholding our company values. We take a holistic  approach to support many aspects of employee well-being. Listed below is a sampling of programs. ,,,,0.872
4786,page 58 of ../pdf/generalmills.pdf,"(207.76739501953125, 213.29190063476562, 309.694580078125, 282.9798889160156)",20,"Our LifeWorks Employee  Assistance program helps  build resilience through  counseling, emotional  support and referrals  for U.S. employees  and their families. ",,,,0.7096
4787,page 58 of ../pdf/generalmills.pdf,"(480.0234375, 213.29190063476562, 590.24658203125, 282.9798889160156)",25,"We support our employees’  career development with  numerous opportunities for  personal and professional  growth, as well as resources  to promote work life  balance. Learn more.  ",,,,0.891
4788,page 58 of ../pdf/generalmills.pdf,"(352.68743896484375, 213.29190063476562, 442.43865966796875, 282.9798889160156)",20,"We support the  financial well-being  of our employees by  providing them with  competitive programs,  resources, salaries and  benefits. Learn more. ",,,,0.7184
4806,page 58 of ../pdf/generalmills.pdf,"(576.0000610351562, 509.3719177246094, 713.6911010742188, 572.432373046875)",38,"v We saw broad employee  engagement gains in fiscal 2020,  continuing an upward trend over  the past three years. The results are  encouraging as hard work and focus  has paid off with positive engagement  trends in all categories. ",,,,0.9325
4814,page 59 of ../pdf/generalmills.pdf,"(248.18341064453125, 266.76190185546875, 383.7587585449219, 369.92791748046875)",48,"The pandemic-induced uncertainty  and resulting changes in the way we  work made listening to our employees  frequently more important than ever.  Through increased listening, we better  understood core needs and introduced  real-time solutions focused on  caring for employees, demonstrating  bold leadership and creating better  ways of working, including: ",,,,0.9509
4848,page 59 of ../pdf/generalmills.pdf,"(54.113197326660156, 456.2293701171875, 214.46153259277344, 559.3953857421875)",62,"Launched in 2017, our Engaging Leader  initiative is transforming the way our leaders  support employees and live our values to  drive performance and engagement. We  accelerated our Engaging Leader strategy  in 2020 to advance leader learning,  development and engagement. We scaled up  training to include all manufacturing teams  and invested in helping leaders focus on  developing a mindset of learning and growing.  ",,,,0.9559
4850,page 59 of ../pdf/generalmills.pdf,"(229.83419799804688, 456.2293701171875, 373.8382568359375, 496.3953857421875)",24,fostering agility and embracing a learning  mindset – prepared leaders to respond  to changing work situations during the  pandemic and help their teams adapt.  ,,,,0.5574
4851,page 59 of ../pdf/generalmills.pdf,"(229.40719604492188, 500.0704040527344, 384.5894775390625, 582.3973999023438)",47,"Advancing equity: Training to encourage  productive discourse – being open to  hearing other perspectives and being  empowered to share opinions and challenge  decisions – is key to our culture, including  advancing equity in our workplace and  communities. This important training focuses  on reducing fear of judgment, modeling  ",,,,0.5267
4873,page 60 of ../pdf/generalmills.pdf,"(355.9107971191406, 514.6911010742188, 485.5107421875, 568.3790893554688)",20,"We gave US$92 million to  charitable causes in fiscal  2020, including General Mills  Foundation grants, corporate  contributions and food donations. ",,,,0.5574
4879,page 60 of ../pdf/generalmills.pdf,"(61.38479995727539, 175.90280151367188, 430.8048095703125, 299.4728088378906)",35,"We are deeply committed to the communities   where we live, operate and from which we source   our ingredients. Our philanthropic partnerships   and employee engagement remain anchored   in advancing equity to build strong and   resilient communities. ",['SDG_9'],,['SDG_9'],0.8268
4953,page 61 of ../pdf/generalmills.pdf,"(594.5, 212.48291015625, 725.2515258789062, 315.64892578125)",52,"For example, to determine the social,  economic and environmental value  generated by regenerative farming  practices – and to better define  the  many stakeholders to whom the  benefits accrue – we engaged in an  analysis in the Cheney Lake Watershed  in Kansas, where General Mills sources  wheat and supports regenerative  agriculture pilot programs.  ",,,,0.9022
