id,page,bbox,text_length,text,aurora,OSDG,combined,sentiment
126,page 3 of ../pdf/generalmills.pdf,"(54.720001220703125, 328.48590087890625, 183.02392578125, 379.3848876953125)",25,n North America Retail 61% n  Convenience Stores and Foodservice 10% n  Europe and Australia 10% n  Asia and Latin America 9% n Pet 10% ,,,,0.0
147,page 3 of ../pdf/generalmills.pdf,"(228.8800048828125, 328.48590087890625, 340.5945739746094, 389.3848876953125)",22,n  Agriculture and transformation 54% n Packaging supply chain 8% n Producing 7% n Shipping 9% n Selling 5%  n Consuming 17% ,,,,0.0
176,page 4 of ../pdf/generalmills.pdf,"(52.92959976196289, 111.0619125366211, 707.3209228515625, 145.81092834472656)",32,"At General Mills, we work to create holistic value throughout our supply chain, from agriculture and  operations to our consumers and communities. Below are some highlights of our progress in fiscal 2020. ",,,,0.743
177,page 4 of ../pdf/generalmills.pdf,"(582.2647705078125, 239.72781372070312, 722.5747680664062, 310.6118469238281)",20,"We gave US$92 million  to charitable causes in  fiscal 2020, including  General Mills Foundation  grants, corporate contributions   and food donations. ",,,,0.5574
181,page 4 of ../pdf/generalmills.pdf,"(53.279998779296875, 581.5838623046875, 412.1173400878906, 597.849853515625)",34,"*Includes food for both humans and pets. Source: SPINS CY2020, Total – US Mulo, Natural Enhanced Channel and Pet Channel. **See the definitions of sustainably sourced for our 10 priority ingredients on page 71. ",['SDG_9'],,['SDG_9'],0.3612
185,page 5 of ../pdf/generalmills.pdf,"(132.42019653320312, 133.1302947998047, 728.6001586914062, 139.5452880859375)",22,Climate change Commodity availability Corporate governance and ethics Diverse consumer needs Food safety Health and nutrition Human rights Responsible sourcing Water stewardship ,['SDG_13'],,['SDG_13'],0.6249
192,page 5 of ../pdf/generalmills.pdf,"(54.0, 344.57080078125, 728.2722778320312, 367.8327941894531)",65,"*In this report, the terms “material” and “materiality” refer to topics that reflect General Mills significant environmental and social impacts or that substantially influence our global responsibility strategy. We are not using these terms as  they have been defined by securities laws in the United States or in the context of financial statements and financial reporting. **Circles note value chain phases for each relevant issue. ",,,,0.802
195,page 5 of ../pdf/generalmills.pdf,"(56.880001068115234, 418.6023864746094, 722.9879760742188, 427.1434020996094)",25,Food safety Ensure facilities worldwide are audited and/or certified by independent third parties using globally recognized food safety criteria (% of facilities) 100% 100% 93%* ,,,,0.8402
199,page 5 of ../pdf/generalmills.pdf,"(56.880001068115234, 466.6020812988281, 722.033935546875, 475.1430969238281)",27,Climate change Reduce absolute GHG emissions across our full value chain by 28% by 2025 and 41-72% by 2050 (% change compared to 2010) -13% -17% -16% ,['SDG_13'],,['SDG_13'],0.128
200,page 5 of ../pdf/generalmills.pdf,"(160.37396240234375, 479.6166076660156, 721.751953125, 486.8825988769531)",24,"All General Mills brands will design 100% of packaging to be recyclable or reusable by 2030 (U.S. data reported, by weight) 89% 88% 88% ",,,,0.0
202,page 5 of ../pdf/generalmills.pdf,"(160.3800048828125, 503.6166076660156, 721.9320068359375, 510.8825988769531)",25,Achieve zero waste to landfill at 30% of our owned production facilities by 2020 and 100% by 2025 (% of production facilities)*** 20% 24% 30% ,,,,-0.5719
203,page 5 of ../pdf/generalmills.pdf,"(56.880001068115234, 514.601806640625, 712.5478515625, 523.1427612304688)",20,Water stewardship Champion the activation of water stewardship plans for the company’s priority watersheds by 2025 Ongoing (see pages 25–27) ,,,,0.5994
208,page 5 of ../pdf/generalmills.pdf,"(54.25, 577.3239135742188, 501.32904052734375, 600.5858764648438)",57,"*Due to audit timing delays in Brazil caused by COVID-19, we did not complete 100% of audits during the fiscal year. **Applies to all General Mills owned production facilities. Normalized to production. ***These facilities sent no waste to landfill or incineration without energy recovery. Data includes facilities that were operating at the end of each fiscal year. ",,['SDG_12'],['SDG_12'],-0.7017
209,page 5 of ../pdf/generalmills.pdf,"(54.0, 93.79000854492188, 735.1215209960938, 112.88790893554688)",58,"This table summarizes the issues that are most material to our global responsibility strategy, based on a materiality assessment conducted in 2018. It includes several priority issues ranked highest by  our stakeholders. We describe information about our approach to and progress on these issues throughout this report and in the Global Reporting Initiative (GRI) index. GRI 102-46, 47 ",,,,0.4215
533,page 7 of ../pdf/generalmills.pdf,"(53.95719909667969, 96.53048706054688, 705.4202880859375, 106.09738159179688)",26,"General Mills supports the United Nations (UN) Sustainable Development Goals (SDGs), and we focus on the goals that align with the company’s material issues and areas   ",['SDG_9'],,['SDG_9'],0.6486
743,page 9 of ../pdf/generalmills.pdf,"(70.22149658203125, 591.5238647460938, 756.0001220703125, 604.735595703125)",25,"*Includes food for both humans and pets. Source: SPINS CY2020, Total - US Mulo, Natural Enhanced Channel and Pet Channel. GENERAL MILLS GLOBAL RESPONSIBILITY    08 ",,,,0.3612
835,page 10 of ../pdf/generalmills.pdf,"(78.91796875, 459.14190673828125, 330.5398864746094, 530.8079223632812)",64,"General Mills is a leader in regenerative agriculture,   a suite of farming principles that helps rebuild soils   and strengthens ecosystems and farming communities.   By applying regenerative practices to growing grains, like oats   for Cheerios®, we can help to sequester carbon in the soil to reduce  greenhouse gas emissions, while delivering whole grains to our consumers.  Learn more about our commitment to advance regenerative agriculture. ",['SDG_13'],,['SDG_13'],0.9241
910,page 11 of ../pdf/generalmills.pdf,"(614.0732421875, 295.0179138183594, 717.5010375976562, 358.0784606933594)",31,"v Two-ounce cereal cups  enable foodservice operators  to more easily meet the  weekly grain requirements  for school meals, so students  get whole grains and key  nutrients in a way they enjoy. ",,,,0.7089
949,page 12 of ../pdf/generalmills.pdf,"(592.0, 262.2118835449219, 735.5799560546875, 293.51983642578125)",33,"n   At least 8 grams of whole grain, a ½ serving of  low-fat or nonfat dairy per regional definition,  or a ½ serving of fruits, vegetables or nuts/ seeds. (22% met these criteria.) ",,,,0.0
1067,page 13 of ../pdf/generalmills.pdf,"(595.2239990234375, 457.53240966796875, 720.4737548828125, 539.6984252929688)",30,Our top-selling Fibre One Chocolate  Fudge Brownie* in the United  Kingdom and Ireland now contains  30% less sugar than  the previous recipe  while maintaining  great taste and the  90-calorie promise.  ,,,,0.8481
1069,page 13 of ../pdf/generalmills.pdf,"(597.0499877929688, 543.6904296875, 725.746337890625, 580.6456909179688)",29,"*AC Nielsen, Total Coverage Inc. Discounters,  latest MAT to Sept. 29, 2020, Fibre One  Chocolate Fudge Brownie 5x24g top selling  SKU in Diet Management, Healthier Biscuits and  Bars category. ",,,,0.2023
1090,page 13 of ../pdf/generalmills.pdf,"(594.9449462890625, 373.2616882324219, 723.6612548828125, 408.9337158203125)",21,"By purchasing Cascadian Farm cereal,  consumers support our work with  The Nature Conservancy to restore  25 million square feet of farmland. ",['SDG_15'],,['SDG_15'],0.5994
1134,page 14 of ../pdf/generalmills.pdf,"(593.9998779296875, 314.5439147949219, 719.1295776367188, 337.8058776855469)",20,"*Includes food for both humans and pets.   Source: SPINS CY2020, Total – US Mulo,   Natural Enhanced Channel and Pet Channel. ",,,,0.3612
1138,page 14 of ../pdf/generalmills.pdf,"(405.0, 289.5118713378906, 554.6182861328125, 334.5779113769531)",30,r Packages of EPIC beef bars feature  the Ecological Outcome Verified symbol  letting consumers know that the beef is  sourced from cattle raised using practices  proven to reduce carbon emissions.  ,,,,0.0
1139,page 14 of ../pdf/generalmills.pdf,"(77.22019958496094, 440.7004089355469, 213.13148498535156, 512.1774291992188)",42,"Blue Buffalo has become the leading  natural pet food brand in the U.S. by  feeding pets like family members. Blue  Buffalo is made with high-quality  ingredients, starting with real meat, and  no corn, wheat, soy, poultry by-product  meals, artificial flavors or preservatives.  ",['SDG_9'],,['SDG_9'],0.4215
1142,page 14 of ../pdf/generalmills.pdf,"(230.2401885986328, 487.2013854980469, 360.8182067871094, 537.6784057617188)",35,"Today, Blue Buffalo has more foods  for specific breed sizes and life stages  than any other natural pet food brand,  so pet parents are sure to find the  right option for their dogs and cats. ",,,,0.5859
1144,page 14 of ../pdf/generalmills.pdf,"(391.32000732421875, 526.6343994140625, 540.010498046875, 562.703125)",22,r Blue Buffalo products meet commercial  pet food criteria outlined by the Global  Nutrition Committee of the World Small  Animal Veterinary Association. ,,,,0.0
1148,page 15 of ../pdf/generalmills.pdf,"(54.17259979248047, 336.1982116699219, 195.6839141845703, 439.52520751953125)",59,"Our approach: Today’s fast-changing  food landscape requires rapid innovation  and a steady stream of new ideas. 301  INC, the venture capital arm of General  Mills, is passionate about food and  everyone who shares that passion. 301  INC partners with emerging brands to  accelerate their growth by nurturing the  skills of founders and providing them  access to General Mills’ capabilities. ",,,,0.9413
1149,page 15 of ../pdf/generalmills.pdf,"(54.17259979248047, 445.8601989746094, 207.5706329345703, 507.0262145996094)",44,"Unlike typical venture capital funds, 301  INC offers more to its portfolio brands than  just a financial investment. 301 INC brands  are given access to a team of 20 functional  experts across marketing, sales, operations  and R&D who serve as partners to the brand  ",,,,0.0
1151,page 15 of ../pdf/generalmills.pdf,"(229.69761657714844, 336.1982116699219, 388.3174133300781, 408.02520751953125)",50,"Our progress: Access to capital, new routes  to market, emerging science and concerns  for the planet have all contributed to a new  wave of food solutions. We see this manifested  in our amazing brand partners. In fiscal  2020, we continued to grow our portfolio  and support for entrepreneurial brands by: ",,,,0.875
1206,page 15 of ../pdf/generalmills.pdf,"(284.91644287109375, 169.0074005126953, 379.565185546875, 223.07066345214844)",22,"v Dairy-free Oui TM by  Yoplait, our French-style  line of coconut milk- based yogurts, is available  in Canada, France and  the U.S. ",,,,0.0
1288,page 16 of ../pdf/generalmills.pdf,"(62.909000396728516, 570.2838745117188, 377.9750061035156, 593.5458984375)",30,"*Global policies cover a broad range of food safety areas, including: regulatory compliance; trace and recall;  labeling; claims; physical, chemical and biological hazards; transportation; and good manufacturing practices  and sanitation. ",,,,0.6908
1293,page 16 of ../pdf/generalmills.pdf,"(405.7349853515625, 533.35791015625, 704.487060546875, 556.805908203125)",50,"*Certification: We are now using a single global certification body for all General Mills owned sites, which  includes annual audits aligned with the Food Safety System Certification (FSSC) standard. Due to audit  timing delays in Brazil caused by COVID-19, we did not complete 100% of audits during the fiscal year. ",,,,0.4215
1415,page 17 of ../pdf/generalmills.pdf,"(73.17579650878906, 351.7323913574219, 301.0537109375, 423.3984069824219)",65,"In the U.S., General Mills supports product labeling changes to help  reduce food waste through clearer guidance for consumers about  food shelf life. We have updated more than 99% of our product  packaging to comply with this voluntary date-labeling initiative that  uses standard nomenclature to reduce consumer confusion. Learn  more about our food waste reduction efforts in the Planet and  Community sections of this report. ",['SDG_12'],,['SDG_12'],-0.3818
1539,page 18 of ../pdf/generalmills.pdf,"(54.0, 571.4439086914062, 720.5519409179688, 586.7078857421875)",58,*Locally applicable programs include: Australia – Responsible Child Marketing Initiative of the Australian Food and Grocery Council; Brazil – Enhanced Commitment to Responsible Advertising to Children pledge; Canada – Canadian  Children’s Food and Beverage Advertising Initiative requirements; Europe – EU Pledge requirements; Singapore – Singapore Food and Beverage Industry Responsible Advertising to Children Initiative; U.S. – CFBAI requirements. ,,,,0.8176
1540,page 18 of ../pdf/generalmills.pdf,"(404.19720458984375, 490.8518981933594, 561.2830810546875, 562.90966796875)",40,v General Mills joined other  food and beverage companies  in signing a letter to the UN  Secretary General in September  2018 highlighting commitments  and achievements to reduce the burden of  noncommunicable diseases in support of   UN Sustainable Development Goal 3.4. ,"['SDG_9', 'SDG_17']",,"['SDG_17', 'SDG_9']",0.0772
1543,page 18 of ../pdf/generalmills.pdf,"(598.47607421875, 164.55239868164062, 721.816162109375, 341.2184143066406)",81,"We collect and use consumer  personal data for a variety of  purposes, including to provide  recipe-related publications to  consumers who subscribe for these,  to run sweepstakes and contests,  to ensure that our advertising is  directed to relevant audiences,  and to otherwise improve our  product and service offerings.  We are sensitive to the privacy  concerns of our consumers and  are fully committed to complying  with regulations, including the EU  General Data Protection Regulation  (GDPR) and the California  Consumer Privacy Act of 2018. ",,,,0.7841
1544,page 18 of ../pdf/generalmills.pdf,"(598.4760131835938, 347.55340576171875, 721.4376831054688, 503.21942138671875)",72,"In addition to meeting changing  legal requirements in this area,  General Mills is committed to acting  responsibly and transparently to  continue to earn and maintain  the trust of our consumers  with respect to our collection,  retention and use of personal  data. We also maintain safeguards  to control against the loss of  personal data or the unauthorized  access, use, disclosure,  destruction or modification  of personal data. Learn more  in our data privacy policy.* ",,,,0.6597
1546,page 18 of ../pdf/generalmills.pdf,"(598.5, 510.2138977050781, 717.053466796875, 541.473876953125)",22,*Links to main U.S. policy as an example.  General Mills has additional privacy  policies specific to other parts of our  business globally. ,,,,0.0
1653,page 19 of ../pdf/generalmills.pdf,"(78.96920013427734, 383.452392578125, 188.44918823242188, 528.618408203125)",64,We have three Annie’s macaroni  and cheese products that are  made with real cheese from  grass-fed dairy cows with  year-round access to pasture.  We work closely with our  supplier partners to ensure  that the organic milk used in  the making of these cheeses  comes from cows that are  raised and treated humanely.  Our packaging encourages  consumers to learn more about  our sustainable food practices. ,"['SDG_9', 'SDG_12']",,"['SDG_9', 'SDG_12']",0.6705
1707,page 21 of ../pdf/generalmills.pdf,"(54.45989990234375, 575.8839111328125, 492.0451965332031, 601.14990234375)",50,"*See the definitions of sustainably sourced for our 10 priority ingredients on page 71. **This is an ongoing process; as we continue to grow our company and identify new watersheds impacted by our business, the target year may change. *** Formal measurement of progress against this goal is under development. ","['SDG_6', 'SDG_9']",,"['SDG_6', 'SDG_9']",0.4215
1709,page 21 of ../pdf/generalmills.pdf,"(436.2417907714844, 312.976806640625, 710.93359375, 348.73480224609375)",26,"Reduce absolute GHG emissions across our full value chain  (Scopes 1, 2 and 3) by 30% by 2030 (compared to 2020);   net zero emissions by 2050 ",,,,0.34
1716,page 21 of ../pdf/generalmills.pdf,"(436.4278869628906, 471.2595520019531, 715.5682373046875, 490.30133056640625)",20,PROGRESS THROUGH 2020: 88% of our U.S. packaging and 72% of our Europe and  Australia packaging was recyclable (by weight).  ,,,,0.5473
1719,page 21 of ../pdf/generalmills.pdf,"(435.7561950683594, 532.8568115234375, 740.2493896484375, 556.6162719726562)",20,Assess and address our human rights impacts in alignment with the  United Nations Guiding Principles on Business and Human Rights ,,,,0.4215
1734,page 22 of ../pdf/generalmills.pdf,"(54.4379997253418, 61.28558349609375, 213.8441925048828, 176.82321166992188)",51,"Leadership and governance: At General  Mills, our Chairman and Chief Executive  Officer has ultimate accountability for  sustainability, which is included in his  annual performance objectives and  impacts his compensation. The Chairman  and CEO convenes the Sustainability  Governance Committee three times each  year to review and approve strategies,  programs and key investments.  ",['SDG_9'],,['SDG_9'],0.0
1735,page 22 of ../pdf/generalmills.pdf,"(54.37479782104492, 183.50662231445312, 203.52679443359375, 251.81008911132812)",30,"In 2020, the Sustainability Governance  Committee was expanded to include  our Chief Financial Officer and  General Counsel and Secretary. This  reflects the continued integration of  sustainability into the company and  ",['SDG_9'],,['SDG_9'],0.0
1737,page 22 of ../pdf/generalmills.pdf,"(229.82589721679688, 101.23611450195312, 389.23040771484375, 169.53958129882812)",28,"Oversight of the company’s sustainability  work is provided by the General Mills  Board of Directors’ Public Responsibility  Committee, which regularly reviews  the company’s sustainability objectives,  strategies and performance.  ",['SDG_9'],,['SDG_9'],0.0
1738,page 22 of ../pdf/generalmills.pdf,"(229.21759033203125, 176.22299194335938, 386.1193542480469, 244.52645874023438)",31,"The company’s Chief Sustainability  and Social Impact Officer stewards  the company’s sustainability work,  reporting to the Chief Global Operations  Officer, and working closely with the  Vice President of Global Sourcing and  ","['SDG_9', 'SDG_12']",,"['SDG_9', 'SDG_12']",0.0
1766,page 22 of ../pdf/generalmills.pdf,"(404.9999084472656, 400.7074890136719, 734.1639404296875, 418.7817687988281)",21,r General Mills helps to address these United Nations Sustainable Development Goals through  the programs and performance described in this section. ,['SDG_9'],,['SDG_9'],0.6597
1767,page 22 of ../pdf/generalmills.pdf,"(580.7958984375, 153.4918975830078, 758.0593872070312, 252.5414276123047)",69,"r Steve Rosenzweig, PhD, a senior agricultural  scientist at General Mills, testified virtually  in December 2020 before the U.S. Senate  Committee on Agriculture, Nutrition, and Forestry.  Rosenzweig highlighted the company’s work in  regenerative agriculture, the need for additional  public research and more. The testimony helped  reinforce General Mills’ leadership in educating  and advocating for policies that support the future  of regenerative agriculture, research, public- private partnership and other topics. ","['SDG_4', 'SDG_17']",,"['SDG_4', 'SDG_17']",0.4019
1859,page 23 of ../pdf/generalmills.pdf,"(54.0, 58.5989990234375, 680.4891967773438, 89.56800079345703)",22,"Climate change u Material issues: Climate change, energy use, food waste, packaging footprint  |  GRI 301 2-3, 302 1-4, 305 1-5, 306-2 ","['SDG_8', 'SDG_12', 'SDG_13']",,"['SDG_8', 'SDG_13', 'SDG_12']",-0.1779
1860,page 23 of ../pdf/generalmills.pdf,"(229.5, 549.2489013671875, 735.1780395507812, 583.514892578125)",95,"*Baseline for 2025 goal and initial 2050 goal is 2010. Baseline for 2030 goal and new 2050 goal is 2020.  **This goal focuses on the categories of GHG emissions that are the most impactful and actionable for General Mills, representing 13.9 million metric tons CO₂e in 2020 (81% of  our total value chain GHG emissions footprint). The following GHG emissions are excluded from this goal, consistent with SBTi guidelines: some low volume ingredients, capital  goods, employee commuting, franchises, downstream warehouse and storage at retail, consumer trips to store and end of life (consumer food waste). ",['SDG_12'],['SDG_12'],['SDG_12'],-0.2732
1964,page 25 of ../pdf/generalmills.pdf,"(54.0, 103.53048706054688, 721.7220458984375, 113.09738159179688)",21,"The Task Force on Climate-related Financial Disclosures (TCFD) develops voluntary, consistent climate-related financial risk disclosures for companies to provide information to  ",['SDG_13'],,['SDG_13'],-0.2732
1965,page 25 of ../pdf/generalmills.pdf,"(54.0, 115.53057861328125, 733.2235717773438, 125.09747314453125)",23,stakeholders. General Mills supports this initiative and is committed to providing our stakeholders with relevant information on climate-related issues. Our approach is summarized  ,['SDG_13'],,['SDG_13'],0.5574
1968,page 25 of ../pdf/generalmills.pdf,"(54.0, 370.0805969238281, 726.057861328125, 379.6474914550781)",24,"In 2020, General Mills commissioned Trucost to assess its climate-related transition and physical risks. Trucost undertook a robust data-driven approach for General Mills’ climate  ",,,,0.0772
1970,page 25 of ../pdf/generalmills.pdf,"(54.0, 398.5805969238281, 719.763427734375, 408.2539978027344)",23,n   Management interviews involving various leaders from across the business to understand the drivers and materiality of GMI’s potential climate-related risks and opportunities ,,,,0.128
1971,page 25 of ../pdf/generalmills.pdf,"(54.0, 415.0805969238281, 709.0476684570312, 424.7539978027344)",23,"n   Physical and transition risk assessment to quantify and qualify exposure to different transition risk categories (policy, market, reputation, technology) and physical climate  ",['SDG_13'],,['SDG_13'],-0.4939
1974,page 25 of ../pdf/generalmills.pdf,"(54.003597259521484, 545.57275390625, 724.5880126953125, 555.1397094726562)",28,"While there are risks associated with climate change, General Mills works to mitigate our risks and exposure through our supply chain and sustainability efforts. The company is well  ","['SDG_9', 'SDG_13']",,"['SDG_13', 'SDG_9']",-0.2732
1975,page 25 of ../pdf/generalmills.pdf,"(54.003597259521484, 557.5728759765625, 740.4491577148438, 567.1398315429688)",25,positioned to respond through targets and initiatives linked to climate change and regenerative agriculture and is actively engaged in policy advocacy to address climate-related issues.  ,['SDG_13'],,['SDG_13'],0.6124
1976,page 25 of ../pdf/generalmills.pdf,"(54.003597259521484, 569.572998046875, 517.8753051757812, 579.1399536132812)",22,We will continue to monitor and assess risk and advance work to ensure a stable climate and resilient future for our business. ,"['SDG_9', 'SDG_13']",,"['SDG_13', 'SDG_9']",0.4019
1981,page 25 of ../pdf/generalmills.pdf,"(53.87000274658203, 175.01220703125, 315.9010314941406, 225.88819885253906)",47,"Governance: The General Mills Board of Directors’ Public Responsibility  Committee provides oversight of the company’s sustainability work – including  our climate program. In addition, our Chairman and CEO convenes the  Sustainability Governance Committee three times each year to review  and approve climate-related strategies, programs and key investments. ","['SDG_9', 'SDG_13']",,"['SDG_13', 'SDG_9']",0.0
1982,page 25 of ../pdf/generalmills.pdf,"(53.968013763427734, 244.49420166015625, 295.52392578125, 295.3702087402344)",54,Risk management: Changes in climate affect global food security and  impact our ability to deliver quality products to consumers and value to  shareholders. Risks associated with climate change include physical risks  as well as risks associated with the transition to a low-carbon economy.  See below for details on our 2020 TCFD climate risk assessment. ,"['SDG_9', 'SDG_13']",['SDG_13'],"['SDG_13', 'SDG_9']",-0.0772
1983,page 25 of ../pdf/generalmills.pdf,"(478.0796813964844, 169.29220581054688, 718.389892578125, 220.16819763183594)",48,"Strategy: As more than 85% of our overall greenhouse gas (GHG)  emissions occur outside of General Mills operations, our climate strategy  focuses on driving transformation and reducing emissions across  our entire value chain. Our General Mills Policy on Climate outlines  our approach to mitigation, adaptation, disclosure and advocacy. ",['SDG_13'],,['SDG_13'],0.34
1984,page 25 of ../pdf/generalmills.pdf,"(477.869384765625, 254.4989013671875, 721.6088256835938, 305.3749084472656)",61,"Metrics and targets: In alignment with the new SBTi 1.5°C guidance,  General Mills will reduce absolute GHG emissions across our full value  chain (Scopes 1, 2 and 3) by 30% by 2030 (compared to 2020). By 2050,  we will achieve net zero GHG emissions across our full value chain. We  report on our metrics and targets annually in our CDP submission. ",,,,0.5859
2082,page 26 of ../pdf/generalmills.pdf,"(249.5352020263672, 498.7978820800781, 382.5064697265625, 547.2869262695312)",27,"Although this represents a small part  of our footprint, we control this phase  directly and are committed to continual  improvement. See the Sustainable  operations section for details.  ",['SDG_9'],,['SDG_9'],0.6249
2084,page 26 of ../pdf/generalmills.pdf,"(249.5352020263672, 409.27789306640625, 364.89520263671875, 477.77294921875)",33,Reducing materials use and using  lower impact materials (such as  recycled content) are the main  strategies that positively impact  water use related to packaging.  See the Packaging supply chain  section for more information. ,,,,0.296
