id,page,bbox,text_length,text,aurora,OSDG,combined,sentiment
2088,page 26 of ../pdf/generalmills.pdf,"(428.4305114746094, 398.11529541015625, 561.8981323242188, 553.7813110351562)",78,"Innovation is essential to driving  progress in this area. We funded  Sustainable Conservation, a California  Water Action Collaborative (CWAC)  partner, to develop a combined  fertilization/drip irrigation system  with private sector partner Netafim to  transform manure from San Joaquin  Valley dairies from a costly waste  product and potential groundwater  pollutant to an agricultural input.  Farmers using the “fertigation” system  on feed corn for dairy cows increased  yield per acre by 2%, improved water  use efficiency by 38% and increased  ","['SDG_9', 'SDG_12']","['SDG_2', 'SDG_6', 'SDG_15']","['SDG_15', 'SDG_2', 'SDG_12', 'SDG_6', 'SDG_9']",0.875
2091,page 26 of ../pdf/generalmills.pdf,"(53.53409957885742, 581.8839111328125, 652.8909301757812, 589.14990234375)",31,"*”The state of the world’s land and water resources for food and agriculture (SOLAW): managing systems at risk,” Food and Agriculture Organization of the United Nations, Rome, and Earthscan, London, 2011. ",,,,0.4215
2114,page 27 of ../pdf/generalmills.pdf,"(54.0, 524.223876953125, 432.9898986816406, 539.4878540039062)",30,"*Reputational water risks refer to companies’ exposure to criticism due to perceptions about their decisions, actions, or impacts on  freshwater resources and ecosystems and the communities that depend on them. ",['SDG_6'],,['SDG_6'],-0.6124
2120,page 27 of ../pdf/generalmills.pdf,"(378.55999755859375, 251.74888610839844, 623.5517578125, 267.01287841796875)",23,n   These high to extremely high watershed impact risks pose financial and brand risk  due to geographically restricted commodity sourcing or plant impact ,,,,-0.7003
2127,page 27 of ../pdf/generalmills.pdf,"(444.0, 374.3089294433594, 730.176025390625, 389.5729064941406)",25,"n   These geographically broad watershed risks cannot be pinpointed to water impacts at a specific  location. As a result, brand risk is low to medium.  ",,,,-0.6486
2135,page 27 of ../pdf/generalmills.pdf,"(86.9000015258789, 240.0460968017578, 212.38829040527344, 290.87310791015625)",23,"Assessment: A study of key  operation and growing region  watersheds, using external standards  and building on work completed  with The Nature Conservancy (TNC) ",,,,0.1779
2191,page 28 of ../pdf/generalmills.pdf,"(53.99489974975586, 294.4043884277344, 255.82298278808594, 347.50238037109375)",76,"Risk levels are based on a combination of the WRI Aqueduct Water Risk  Atlas and the WWF Water Risk Filter, customized to General Mills. We  refresh our water risk assessment every three years, and that process  was underway during the development of this report. Some of the  priority watersheds noted in this map will change, for example in China  due to recent structural changes in our business. We plan to publish the  updated version in 2021. ",['SDG_6'],,['SDG_6'],-0.7506
2203,page 28 of ../pdf/generalmills.pdf,"(578.183837890625, 470.88189697265625, 715.1248168945312, 563.5479125976562)",53,"Building on the momentum of the  Science Based Targets initiative (SBTi)  for climate, General Mills has joined the  Science Based Targets Network (SBTN)  working group on freshwater to help  companies and cities define and use  targets based on planetary boundaries  to reduce their impact on – and help  restore – the Earth’s freshwater. ","['SDG_13', 'SDG_15']",,"['SDG_15', 'SDG_13']",0.765
2209,page 28 of ../pdf/generalmills.pdf,"(68.01920318603516, 470.88189697265625, 165.93521118164062, 511.04791259765625)",20,"In 2020, General Mills  achieved a place on the CDP  ‘A List’ for water security, for  the 3rd consecutive year. ",,,,0.34
2211,page 28 of ../pdf/generalmills.pdf,"(202.5142059326172, 470.88189697265625, 351.4530944824219, 563.5479125976562)",57,"In the 2020 update of its Feeding Ourselves  Thirsty analysis, Ceres ranked General  Mills No. 3 of 18 packaged food companies  (and No. 3 of 40 food and beverage sector  companies overall). The study assessed  how companies are responding to water  risks in governance and management,  direct operations, the manufacturing supply  chain and the agricultural supply chain. ",,,,-0.6705
2212,page 28 of ../pdf/generalmills.pdf,"(390.772216796875, 470.88189697265625, 535.8121948242188, 563.5479125976562)",49,"General Mills continues to participate   in the Ceres and WWF AgWater Challenge  to protect freshwater in our agricultural  supply chain. In 2016, we were named   an AgWater Steward for having far- reaching, ongoing water commitments,  reducing water risk in agricultural supply   chains and supporting producers in   addressing these issues. ",,,,0.7184
2324,page 29 of ../pdf/generalmills.pdf,"(467.4457092285156, 265.334716796875, 550.9799194335938, 367.2818603515625)",21,Cocoa Vanilla Oats U.S. wheat U.S. sugar beets U.S. corn (dry-milled) U.S. dairy (raw fluid milk) Fiber packaging Sugarcane Palm oil ,,,,0.0
2407,page 30 of ../pdf/generalmills.pdf,"(55.28379821777344, 576.723876953125, 526.0791625976562, 591.9878540039062)",37,"*Cocoa includes chocolate as well as cocoa powder, converted into cocoa bean equivalents. See the definition of sustainably sourced for this ingredient on page 71. **See the definition of sustainably sourced for this ingredient on page 71. ",['SDG_9'],,['SDG_9'],0.2732
2629,page 32 of ../pdf/generalmills.pdf,"(54.0, 511.8839416503906, 513.3479614257812, 519.14990234375)",23,*Trend classified as positive if all engagements had positive results; threshold of two-thirds of engagements to determine classification as either negative or mixed. ,,,,0.6908
2713,page 33 of ../pdf/generalmills.pdf,"(64.16720581054688, 264.5608825683594, 197.90086364746094, 300.2329406738281)",24,Ninety percent of the fiber we use in  our packaging comes from the United  States and Canada – areas at low risk  for deforestation.  ,,,,-0.1027
2869,page 34 of ../pdf/generalmills.pdf,"(73.20459747314453, 512.1483154296875, 207.2119140625, 562.8143310546875)",24,"integrate independent smallholders  from villages neighboring the Leuser  Ecosystem in Aceh Singkil, Sumatra,  Indonesia, into the sustainable palm oil  supply chain to reduce deforestation  ","['SDG_9', 'SDG_15']",,"['SDG_15', 'SDG_9']",0.0
2871,page 34 of ../pdf/generalmills.pdf,"(225.33558654785156, 512.1483154296875, 362.3529052734375, 552.3143310546875)",22,"hiring of village extension officers who  will provide good agricultural practice,  financial literacy and NDPE training and  resources to smallholders. Learn more.  ",['SDG_4'],,['SDG_4'],0.4404
2938,page 35 of ../pdf/generalmills.pdf,"(54.0, 95.95861053466797, 672.8751220703125, 105.45761108398438)",23,"u Material issues: Biodiversity, climate change, commodity availability, farmer livelihoods, human rights, responsible sourcing, water stewardship   |  GRI 102-12, 13, 201-1, 304-2, 3 ",['SDG_13'],,['SDG_13'],0.4939
2939,page 35 of ../pdf/generalmills.pdf,"(54.0, 290.364013671875, 723.682861328125, 313.6259765625)",73,"*General Mills regenerative agriculture efforts will focus on our most GHG emissions-intensive ingredient categories: wheat, oats, dry corn/sweeteners, fats and oils, dairy, sugar, chocolate/cocoa, meat, nuts and miscellaneous grains  (barley, cassava, rice). One million acres represents about 20% of our sourcing footprint in North America. We are developing measurement and tracking criteria and plan to report progress against this goal in the next fiscal year. See  Understanding impacts and assessing progress for detail. ",,,,0.5106
2941,page 35 of ../pdf/generalmills.pdf,"(230.7100067138672, 560.4331665039062, 415.5317687988281, 596.3229370117188)",36,"SOIL HEALTH: Soil is a complex ecosystem that forms  the base of the food chain for humans and land animals.  It plays an essential role in cleaning and storing water,  supporting biodiversity and regulating the climate. ","['SDG_6', 'SDG_13']",['SDG_2'],"['SDG_6', 'SDG_13', 'SDG_2']",0.5994
2942,page 35 of ../pdf/generalmills.pdf,"(194.6099853515625, 485.0479431152344, 359.8560791015625, 538.9332275390625)",35,"WATER MANAGEMENT:   Regenerative agriculture helps maximize   water use efficiency in rain-fed and irrigated   systems, and can reduce agriculture’s impact on   water quality, helping to protect and restore clean  water in nearby streams, rivers and lakes. ",['SDG_9'],['SDG_6'],"['SDG_6', 'SDG_9']",0.9153
2943,page 35 of ../pdf/generalmills.pdf,"(209.72000122070312, 396.2596435546875, 321.3988342285156, 450.1448669433594)",22,"BIODIVERSITY: Diversity in crop  varieties, grazing animals, wildlife  and pollinators supports resilient  ecosystems that can better  withstand disease, pests and  climate shocks. ","['SDG_9', 'SDG_13', 'SDG_14']",['SDG_2'],"['SDG_14', 'SDG_9', 'SDG_13', 'SDG_2']",0.4215
2945,page 35 of ../pdf/generalmills.pdf,"(635.2582397460938, 405.9114074707031, 738.6217041015625, 450.5626220703125)",21,Rotational grazing and feeding  cows a diverse mix of crops  support cow health and  increase resiliency across the  whole dairy ecosystem. ,,,,0.6124
2954,page 35 of ../pdf/generalmills.pdf,"(578.40966796875, 526.3513793945312, 738.6214599609375, 571.0026245117188)",29,Regenerative agriculture practices reduce   the need for more expensive inputs by   fostering natural nutrient cycling and pest  suppression. These practices can strengthen  whole farm profitability and resilience over time.  ,['SDG_2'],,['SDG_2'],0.7096
2958,page 36 of ../pdf/generalmills.pdf,"(54.23160171508789, 61.28558349609375, 717.0169067382812, 71.66618347167969)",25,"Challenges and opportunities: We depend on thriving ecosystems and farming communities for the food we make and eat, but many critical challenges threaten their future.  ",,,,-0.6059
3009,page 36 of ../pdf/generalmills.pdf,"(69.99864959716797, 172.74789428710938, 158.1333770751953, 219.09341430664062)",22,"Globally, about 33% of the  Earth’s soils are already  degraded, and that is  projected to increase to  more than 90% by 2050.* ",,,,-0.128
3010,page 36 of ../pdf/generalmills.pdf,"(69.99864959716797, 292.1554260253906, 152.76039123535156, 366.9927062988281)",24,"Regenerative agriculture  principles help to  rebuild and restore soil  health and function. For  example, minimizing  physical and mechanical  disturbance helps to  prevent soil erosion. ",['SDG_15'],,['SDG_15'],0.6124
3012,page 36 of ../pdf/generalmills.pdf,"(177.99864196777344, 172.71420288085938, 274.7052917480469, 238.05422973632812)",28,"The profitability of farming  has been under ongoing  pressure due to rising costs  of inputs needed to maintain  yields, such as seed,  synthetic fertilizers and  pesticides, and equipment.  ",,,,-0.0258
3013,page 36 of ../pdf/generalmills.pdf,"(177.99864196777344, 292.1149597167969, 261.19775390625, 376.4494934082031)",25,"Regenerative agriculture  can help farmers  maintain production  while reducing the  need for costly external  inputs such as synthetic  pesticides and fertilizers,  improving profitability  and resilience.  ",['SDG_2'],,['SDG_2'],0.7351
3015,page 36 of ../pdf/generalmills.pdf,"(288.4826354980469, 191.66824340820312, 379.4854736328125, 247.51101684570312)",22,"Agriculture must reduce  GHG emissions and  increase climate resilience  while producing food, fiber  and fuel to keep pace with  a growing population.  ","['SDG_2', 'SDG_13']",,"['SDG_13', 'SDG_2']",0.4588
3016,page 36 of ../pdf/generalmills.pdf,"(288.4826354980469, 292.07452392578125, 379.519287109375, 347.91729736328125)",22,Regenerative agriculture  helps sequester carbon in  soil while reducing reliance  on fossil fuel based inputs  and increasing resilience to  extreme weather events.  ,['SDG_2'],['SDG_13'],"['SDG_13', 'SDG_2']",0.3818
3018,page 36 of ../pdf/generalmills.pdf,"(397.400634765625, 182.13729858398438, 505.58294677734375, 266.4718322753906)",39,"On average, agriculture accounts  for 70% of global freshwater  withdrawal. In many critical  aquifers, water is being used  faster than it can be replenished.  Poor soil management practices  result in nutrient and sediment  runoff that contaminates  nearby water bodies.  ",,,,-0.6486
3019,page 36 of ../pdf/generalmills.pdf,"(397.400634765625, 292.0340881347656, 495.3087463378906, 376.3686218261719)",41,"Regenerative agriculture  helps to keep soil and  nutrients on the farm where  they belong, which can lead  to cleaner water. Healthy  soil can accept and store  more water, ensuring more  is utilized by plants and not  lost to evaporation or runoff.   ",,,,0.8988
3020,page 36 of ../pdf/generalmills.pdf,"(516.50439453125, 140.09835815429688, 609.7965087890625, 205.43838500976562)",26,Biodiversity loss  negatively affects  farm productivity  and resilience. One million  species on our planet – an  eighth of all species – are at  risk of extinction.** ,,['SDG_2'],['SDG_2'],-0.5267
3022,page 36 of ../pdf/generalmills.pdf,"(516.50439453125, 291.9869079589844, 610.3357543945312, 347.8296813964844)",21,"Regenerative agriculture  restores these critical  services, many of which can  naturally suppress yield- limiting threats like weeds,  disease and other pests.  ",,,,-0.1027
3023,page 36 of ../pdf/generalmills.pdf,"(629.006591796875, 140.05792236328125, 725.3361206054688, 243.386962890625)",43,"Climate change and  agriculture have a  significant impact  on human rights. People and  communities around the  world are facing significant  challenges related to access  to food, shelter, water and  sanitation, as well as living  and working conditions such  as forced and child labor. ","['SDG_2', 'SDG_6', 'SDG_8', 'SDG_13']",,"['SDG_8', 'SDG_6', 'SDG_13', 'SDG_2']",0.25
3024,page 36 of ../pdf/generalmills.pdf,"(629.006591796875, 291.9464416503906, 727.597412109375, 385.7782287597656)",38,"Improved economic and  environmental resilience  from regenerative agriculture  can contribute to improved  outcomes for farmers, farm  laborers and the broader  community, such as better  living and working conditions  and basic human rights like  access to food and water. ",['SDG_2'],,['SDG_2'],0.891
3114,page 37 of ../pdf/generalmills.pdf,"(67.71240234375, 492.0419006347656, 182.2877197265625, 550.722900390625)",23,"Assessing plant species diversity,  collecting insect samples,  measuring insect services such  as pollination, and measuring  bird species diversity as  indicators of ecosystem health ",['SDG_15'],,['SDG_15'],0.0
3115,page 37 of ../pdf/generalmills.pdf,"(203.2113800048828, 492.0558776855469, 312.9433898925781, 540.73388671875)",24,Modeling farmers’ impact on  water quality and quantity and  conducting in-field tests to see  how well the soil absorbs water  during heavy rain events  ,['SDG_9'],,['SDG_9'],0.2732
3123,page 38 of ../pdf/generalmills.pdf,"(416.3876037597656, 70.16841125488281, 713.5822143554688, 97.37044525146484)",30,"We are partnering with organic and conventional farmers, suppliers and trusted  farm advisors in key growing regions to drive the adoption of regenerative farming  principles. Starting with pilot programs on: ",,,,0.5859
3153,page 38 of ../pdf/generalmills.pdf,"(210.47998046875, 461.4651794433594, 392.01129150390625, 569.511962890625)",86,"v Fresh Roberson, a granddaughter to  sharecroppers, developed a connection to the land  early. As a long-time grower, beginning farmer and  chef, Fresh works to advance racial equity in the  Midwestern grain economy while making quality  fresh food accessible to the community. They  currently farm in Chicago, Illinois, while looking to  expand to a larger plot of rural land. Chef Fresh is  the Director of Chicago Bread Club and founder of  Fresher Together, a collaborative food and farming  project for healing, economic development,  training and retreat. ","['SDG_4', 'SDG_9']",['SDG_11'],"['SDG_11', 'SDG_4', 'SDG_9']",0.8834
3154,page 38 of ../pdf/generalmills.pdf,"(547.481689453125, 461.4361877441406, 713.48486328125, 560.4857177734375)",73,"v Sara Williams Flewelling is a 2nd generation  organic farmer, professional miller and baker.  She and her father, Matthew Williams, own  Aurora Mills and Farm, a hands-on, family- owned business devoted to providing the  very best Maine-grown, USDA certified,  organic grains. Aurora Mills is a pioneer in the  resurgence of the grain growing economy in  Maine and specializes in regenerative organic  growing practices, such as diversifying and  identifying alternative crops for grain rotations. ",,,,0.8622
3157,page 38 of ../pdf/generalmills.pdf,"(229.4998779296875, 224.9918975830078, 387.06207275390625, 369.0277099609375)",97,"r Cascadian Farm is partnering with   The Nature Conservancy to protect natural  resources, help restore the health of farm  ecosystems and make farming operations  more resilient to threats like climate change.  As highlighted on our Cascadian Farm  cereal boxes, we are committing $750,000  to The Nature Conservancy over two  years to help rebuild wildlife habitat and  regenerate groundwater on over 600   acres of farmland – 25 million square feet –   in California’s Sacramento Valley. This  partnership is one step on our journey   to advance regenerative agriculture and  connect consumers to the land that   feeds them. Learn more.  ","['SDG_2', 'SDG_6', 'SDG_9', 'SDG_13', 'SDG_15']",,"['SDG_15', 'SDG_13', 'SDG_2', 'SDG_6', 'SDG_9']",0.8869
3159,page 38 of ../pdf/generalmills.pdf,"(71.38529968261719, 426.2200927734375, 721.6646118164062, 455.8861083984375)",59,"The Stone Barns Regenerative Farming Fellowship, launched in 2019 with support from the General Mills Foundation, supports farmers in their transition to regenerative farming principles.  The program’s peer cohort model fosters participants’ development as both practitioners and ambassadors of regenerative farming. Below is a current participant from each of the  program’s two focus regions: the Midwest and the Northeast.  ",,,,0.6908
3203,page 39 of ../pdf/generalmills.pdf,"(405.0, 240.48399353027344, 725.189697265625, 255.74798583984375)",20,"*Includes food for both humans and pets. Source: SPINS CY2020, Total – US Mulo, Natural Enhanced Channel and  Pet Channel.  ",,,,0.3612
3204,page 39 of ../pdf/generalmills.pdf,"(54.0, 393.4073181152344, 396.4165954589844, 438.07861328125)",27,"We have invested more than $8.5 million to   advance soil health In partnership with The Nature Conservancy, we  developed Rethink Soil: A Roadmap to U.S. Soil Health ",['SDG_15'],,['SDG_15'],0.0
3213,page 39 of ../pdf/generalmills.pdf,"(422.1773986816406, 303.9219055175781, 550.71142578125, 438.5879211425781)",63,"In 2018, General Mills engaged in a  strategic sourcing arrangement with  South Dakota-based Gunsmoke  Farms LLC to convert 34,000 acres  of conventionally managed farmland  to certified organic. As part of  this agreement, General Mills has  partnered with Midwestern BioAg to  provide on-the-ground mentorship  for the farm operators to implement  regenerative principles such as  maximizing diversity by adding more  crops to the growing rotation. ",,,,0.7992
3214,page 39 of ../pdf/generalmills.pdf,"(422.07940673828125, 446.4208984375, 557.228515625, 528.5869140625)",41,"Gunsmoke, located outside of Pierre,  South Dakota, had been managed  conventionally for more than three  decades before its transition to  organic over the last three years using  regenerative agriculture principles. The  combination of cover crops, a diverse  crop rotation, planting perennial  ",,,,0.0
3215,page 39 of ../pdf/generalmills.pdf,"(577.83642578125, 303.921875, 718.906982421875, 459.587890625)",87,"crops, and minimizing tillage were  instrumental in restoring the land to a  holistic farming system that now grows  spring wheat, winter wheat, alfalfa,  oats, peas and Kernza. In addition, farm  managers will plant nearly 3,000 acres  of pollinator habitat throughout the farm  in partnership with the Xerces Society  for Invertebrate Conservation (Xerces  Society). In the summer of 2020, the  farm received organic certification by  the U.S. Department of Agriculture’s  National Organics Program. The organic  wheat from the farm will be used to  make Annie’s Mac and Cheese. ",['SDG_15'],,['SDG_15'],0.296
3216,page 39 of ../pdf/generalmills.pdf,"(577.2205200195312, 467.4208679199219, 720.1047973632812, 507.5868835449219)",23,"This type of long-term, direct contracting  is unprecedented for General Mills and  the industry. This agreement provides  farmers and landowners a high level  ",,,,0.4939
3219,page 39 of ../pdf/generalmills.pdf,"(54.0, 100.53048706054688, 733.3665161132812, 110.09738159179688)",23,"Even before our regenerative agriculture commitment, General Mills had been actively engaged in work to promote ecosystem health, including our sustainable sourcing program;  ","['SDG_2', 'SDG_9', 'SDG_15']",,"['SDG_15', 'SDG_9', 'SDG_2']",0.8481
3220,page 39 of ../pdf/generalmills.pdf,"(54.0, 112.53057861328125, 728.6267700195312, 122.09747314453125)",27,"initiatives related to soil health, pollinators and organic farming; as well as efforts to reduce pesticide use. These have all helped inform our regenerative agriculture approach and  ",,,,0.2732
3224,page 39 of ../pdf/generalmills.pdf,"(404.77740478515625, 166.92730712890625, 503.36004638671875, 231.6914825439453)",21,"Together our Annie’s,  Cascadian Farm and  Muir Glen brands  accounted for more than  70,000 acres of organic  acreage in fiscal 2020. ",,,,0.0
3236,page 40 of ../pdf/generalmills.pdf,"(73.0, 422.4118957519531, 197.9892120361328, 539.4559326171875)",41,"w In fiscal 2020,  our Annie’s brand  launched a special- edition fruit snack  product called  Bees, Bugs and  Butterflies. This new  product highlights  our partnership with  The Xerces Society,  features fun pollinator shapes, and  provides consumers important  information about pollinator health. ",,,,0.8074
3237,page 40 of ../pdf/generalmills.pdf,"(229.4984893798828, 422.37567138671875, 354.3724670410156, 512.427978515625)",35,"w In partnership with Observatoire  Français d’Apidologie (OFA), our  Yoplait team launched a multi-year  campaign to protect pollinators,  resulting in more than   300 million bee- friendly flowers  planted in  France in fiscal  2019 and 2020. ",,,,0.743
3403,page 41 of ../pdf/generalmills.pdf,"(64.0, 450.8186950683594, 133.9464874267578, 557.8931884765625)",33,General Mills was  an early adopter of  responsible sourcing  and developed  a program for  manufacturing  facilities producing  premiums (such as  toys included in or on  pack) and supplier  facilities which license  our brands ,,,,0.3182
3405,page 41 of ../pdf/generalmills.pdf,"(307.43798828125, 450.8512268066406, 379.7888488769531, 539.9207153320312)",32,"Added more Tier 1   direct materials  suppliers in North  America and also  expanded to locations  in Asia, Latin America,  Europe, and Australia,  as well as Blue  Buffalo locations in  our Pet segment ",,,,0.2732
3406,page 41 of ../pdf/generalmills.pdf,"(226.09048461914062, 450.8707580566406, 294.9840087890625, 548.9428100585938)",28,Expanded program  to also include  locations of  inherently high-risk  Tier 1 direct materials  suppliers in North  America (suppliers  that provide  ingredients used in  our food products  or packaging)  ,,,,0.0
3407,page 41 of ../pdf/generalmills.pdf,"(54.0, 405.0220031738281, 566.138427734375, 547.611083984375)",75,"Global Responsible Sourcing timeline To segment our Tier 1 suppliers into  different risk levels, we consider factors  including geography, ingredient category,  and the results of prior responsible  sourcing audits from around the world,  covering health and safety, human rights,  business integrity and the environment.  The audit-related data sources used  include 3,655 SMETA supplier audits,  12,763 ISO 14001 supplier audits and  1,324 SA8000 supplier audits. These  17,742 supplier audits were concentrated  in countries with known environmental,  ",,,,0.7845
3408,page 41 of ../pdf/generalmills.pdf,"(577.688232421875, 412.9450988769531, 719.1856689453125, 537.111083984375)",67,"social and governance risks, based  on public sources including the Yale  Performance Index, the Social Progress  Global Index, the Worldwide Governance  Index and the Corruption Perception  Index. Our segmentation, completed  in January 2019, was determined  based on an aggregation of this data.  We selected these data sources to  uncover risks as outlined in our Supplier  Code of Conduct, focused heavily on  human rights and health and safety. ",['SDG_16'],['SDG_16'],['SDG_16'],0.7506
3474,page 42 of ../pdf/generalmills.pdf,"(421.560302734375, 431.8538818359375, 563.1773071289062, 545.5198974609375)",62,"To provide education and a forum for  peer sharing on responsible sourcing  and supplier diversity topics, we  hold Corporate Social Responsibility  Communities of Practice on a quarterly  basis for the Sourcing and Sustainability  teams. These events are designed to  increase consideration in daily decision  making about issues that impact people  and to promote networking between the  two teams. The Communities of Practice  ","['SDG_4', 'SDG_9', 'SDG_12']",,"['SDG_4', 'SDG_9', 'SDG_12']",0.8402
3475,page 42 of ../pdf/generalmills.pdf,"(577.8353271484375, 431.8538818359375, 718.7797241210938, 535.0198974609375)",64,"take place globally, with 80 to 100  people participating in each session. For  example, in June 2020, to build on the  company’s Pride month events, we held  a global call on the LGBTQ+ community  fight for human rights and equity.  Participants learned about the start of  this human rights movement in the U.S.  and discussed how we all might advance  understanding within General Mills. ",,,,-0.0516
