id,page,bbox,text_length,text,aurora,OSDG,combined,sentiment
4954,page 61 of ../pdf/generalmills.pdf,"(594.5, 321.9839172363281, 727.717041015625, 404.1499328613281)",41,"The third-party study found that for  every US$1 in costs to implement  regenerative practices on-farm, there  is approximately US$5 in social return  on investment to a wide variety of  stakeholders – farmers/landowners,  taxpayers, local communities, municipal  water plants and water users. ",['SDG_6'],,['SDG_6'],0.0
4955,page 61 of ../pdf/generalmills.pdf,"(580.4984130859375, 524.8839111328125, 718.1742553710938, 559.14990234375)",26,"*Includes food donations, Box Tops for  Education TM and other corporately funded cause  marketing and charitable contributions, as well  as giving from the General Mills Foundation. ",['SDG_4'],,['SDG_4'],0.8591
4960,page 61 of ../pdf/generalmills.pdf,"(54.380001068115234, 564.4883422851562, 552.8246459960938, 582.5625610351562)",26,"r Our philanthropy work is strongly aligned with many of the United Nations’ Sustainable Development Goals (SDGs), including goals 2, 5, 6,  12, 13 and 15. ",['SDG_9'],,['SDG_9'],0.5994
4982,page 62 of ../pdf/generalmills.pdf,"(234.54539489746094, 224.3245849609375, 382.9905700683594, 275.6662292480469)",20,17 million meals were donated by General Mills to  Feeding America to help families in  need as the pandemic unfolded. ,,,,0.4019
4986,page 62 of ../pdf/generalmills.pdf,"(447.14581298828125, 332.8717956542969, 582.516845703125, 364.97607421875)",20,"Old El Paso helped raise $150,000 for  Feeding America and the LeBron  James Family Foundation through its  #TacoTuesdayChallenge social campaign. ",,,,0.0
5034,page 63 of ../pdf/generalmills.pdf,"(580.7957763671875, 511.4919128417969, 737.3294677734375, 574.5523681640625)",45,"r Our Rooty Hill plant in Sydney produced  45,000 meals in May 2020 through our  manufacture-to-donate initiative to help  Australians in need, and went on to develop  a collaborative program in partnership with  our suppliers that is providing 10,000 meals  per month for Foodbank Australia. ",,,,0.4019
5040,page 63 of ../pdf/generalmills.pdf,"(593.9193725585938, 274.8222961425781, 727.8396606445312, 317.5928955078125)",21,"of General Mills food produced for  donation to the Feeding America  network in response to COVID-19,  resulting in 4.2 million meals.  ",,,,0.0
5044,page 63 of ../pdf/generalmills.pdf,"(258.1199951171875, 488.12188720703125, 532.5560913085938, 517.7879028320312)",27,"We work year-round with committed partners to support community-driven  solutions that expand food security, food equity and build long-term resilience for  the future. Highlighted grant partners include: ",,,,0.8934
5051,page 63 of ../pdf/generalmills.pdf,"(240.1199951171875, 175.64190673828125, 554.9100952148438, 236.8079071044922)",80,"Our response to COVID-19 focuses on ensuring food access for vulnerable populations.  According to the UN World Food Program, the COVID-19 pandemic may nearly double the  number of people suffering acute hunger globally. To help meet that need, General Mills and  our Foundation provided an incremental US$14 million in cash grants and food donations  between March and November 2020 to help food banks, food pantries and other leading  anti-hunger organizations rise to meet elevated community needs driven by the pandemic. ","['SDG_2', 'SDG_3']",,"['SDG_2', 'SDG_3']",0.4019
5057,page 63 of ../pdf/generalmills.pdf,"(405.760009765625, 321.8418884277344, 552.9342651367188, 372.5079040527344)",28,General Mills locations around the world  mobilized to produce food for donation in  response to COVID-19. Learn more about  our manufacture-to-donate initiative in the  U.S. with Feeding America. ,,,,0.0
5058,page 63 of ../pdf/generalmills.pdf,"(405.760009765625, 254.64187622070312, 549.3720092773438, 305.3078918457031)",23,We supported select United Way chapters  and strategic community partners to  help them meet local  food needs and other  urgent social services.  ®  ,,,,0.8225
5061,page 63 of ../pdf/generalmills.pdf,"(240.1199951171875, 329.8418884277344, 380.56744384765625, 380.5079040527344)",23,We invested $9 million in innovative  food access programs to ensure children  from lower-income households  had meals during school  closures around the world.* ,['SDG_2'],,['SDG_2'],0.6705
5089,page 64 of ../pdf/generalmills.pdf,"(405.0, 194.3668975830078, 561.7442016601562, 257.42742919921875)",40,"r General Mills funding helped FareShare  provide support to 1,325 additional charities  from March to June 2020 – a 265% increase  in organizations requesting food compared  with 2019. FareShare helped charities  distribute 188% more food, enough for   32.6 million meals.  ",,,,0.886
5090,page 64 of ../pdf/generalmills.pdf,"(580.5001220703125, 194.3668975830078, 738.8392944335938, 230.43565368652344)",25,r General Mills donated 1.95 million pounds  of pet food valued at more than US$3.51  million to charitable partners for distribution  to furry family members.** ,,,,0.6808
5094,page 64 of ../pdf/generalmills.pdf,"(593.9177856445312, 303.7073059082031, 736.6080322265625, 357.4747009277344)",20,retailers and foodservice operators  worldwide empowered to participate  in systemic food rescue through our  global investments in food recovery  technology ,,,,0.5106
5098,page 64 of ../pdf/generalmills.pdf,"(593.9335327148438, 369.6390075683594, 737.2152099609375, 430.2810974121094)",20,"pounds of good, surplus food – equal  to 1.9 billion meals – recovered and  charitably redistributed since 2014 2.3 billion ",,,,0.6486
5100,page 64 of ../pdf/generalmills.pdf,"(54.0, 575.203857421875, 554.6952514648438, 600.4698486328125)",47,"*Compared to 2020 **Charitable contributions (cash and food donations) by our Pet Food division for fiscal 2020 totaled US$5.1 million. Charitable partners include Helen Woodward Animal Center,  Stray Animal Adoption Program, Ohio State, Petco Foundation – ASPCA, Basset and Beagle, and other shelter and pet rescue programs. ",,,,0.7184
5102,page 64 of ../pdf/generalmills.pdf,"(64.15630340576172, 296.701904296875, 538.8267211914062, 336.867919921875)",83,"Since food waste and loss occur along the entire ""farm-to-fork” continuum – impacting growers, families, communities, the environment and  businesses – we engage with a wide variety of partners to advance positive change. We bring a systems lens and take a collective impact  approach to the issue, working with cross-sector coalitions and nonprofit organizations around the globe with a focus on scaling innovation in  surplus food recovery, so that the world’s good surplus food can be redistributed to charities who nourish hungry people. ",['SDG_12'],,['SDG_12'],0.8625
5103,page 64 of ../pdf/generalmills.pdf,"(205.997314453125, 394.6039123535156, 548.14892578125, 424.2699279785156)",26,"ReFED works across sectors to accelerate and scale solutions with businesses, government leaders,  environmental organizations, community nonprofits, researchers, investors and others committed to  reducing food waste. ","['SDG_12', 'SDG_14']",,"['SDG_14', 'SDG_12']",0.0
5104,page 64 of ../pdf/generalmills.pdf,"(205.997314453125, 438.70391845703125, 550.2223510742188, 478.86993408203125)",59,"Food Recovery Network helps student volunteers at colleges and universities fight food waste and  hunger by recovering perishable food from their campus dining halls and donating it to community  charities serving people in need. Learn about Food Recovery Network’s innovative COVID-19 response,  pivoting to partner with The FarmLink Project to rescue 25 million pounds of food across 40+ states. ","['SDG_2', 'SDG_3', 'SDG_12']",,"['SDG_12', 'SDG_2', 'SDG_3']",0.6808
5105,page 64 of ../pdf/generalmills.pdf,"(125.64434814453125, 494.9419250488281, 503.82666015625, 514.10791015625)",20,"Food banks reduce food waste by recovering and redirecting perfectly edible, nutritious foods to people in need.  Our partners include: ",['SDG_12'],,['SDG_12'],0.34
5120,page 65 of ../pdf/generalmills.pdf,"(76.21969604492188, 199.79318237304688, 196.42369079589844, 348.5010681152344)",80,"We closely monitor and manage  our production processes to  keep surplus food out of the  waste stream. Surplus food from  our operations is first offered  to food bank partners to feed  hungry people; the remainder  is repurposed for animal feed  or anaerobic digestion. In fiscal  2020, 4.6% of our total production  was food waste, and less than  1% of that went to disposal.* In  addition, 13 facilities (30% of the  global total) met our zero-waste- to-landfill criteria in fiscal 2020. ",['SDG_12'],['SDG_2'],"['SDG_2', 'SDG_12']",-0.6808
5121,page 65 of ../pdf/generalmills.pdf,"(76.23369598388672, 354.33203125, 187.75772094726562, 413.0130920410156)",33,"We also work to reduce food  waste in our office buildings. At  our headquarters, 85% of total  waste was recycled, 0.55% went  to landfill, and 9% of total food  waste was compost material. ",['SDG_12'],,['SDG_12'],-0.8126
5123,page 65 of ../pdf/generalmills.pdf,"(205.81771850585938, 199.84906005859375, 326.3289794921875, 318.5479736328125)",54,"We actively participate in industry,  nonprofit and government groups  focused on food loss and waste  reduction as well as surplus food  recovery, including AMERIPEN, the  Food Waste Reduction Alliance,  the Consumer Brands Association,  the International Food Waste  Coalition, ReFED, Consumer  Goods Forum Food Waste  Coalition of Action, MBOLD, and  the U.S. Food Waste Challenge. ","['SDG_12', 'SDG_16']",['SDG_12'],"['SDG_16', 'SDG_12']",-0.8402
5124,page 65 of ../pdf/generalmills.pdf,"(205.7547149658203, 324.37896728515625, 318.237060546875, 403.06597900390625)",44,"We are part of an industry effort  to standardize food date labels  to improve clarity about food  quality and safety and reduce  the amount of good food that’s  thrown away. As of June 2020,  we have updated more than  99% of our U.S. packages. ",['SDG_9'],,['SDG_9'],0.8834
5125,page 65 of ../pdf/generalmills.pdf,"(334.7787170410156, 199.89797973632812, 455.8983459472656, 298.5909118652344)",48,"General Mills is committed to  increasing surplus food recovery,  especially among consumer-facing  food businesses – grocery stores,  restaurants and other food outlets.  These organizations collectively  account for 36% of all food  waste, roughly 50 billion pounds  (more than 20 million metric  tons) per year in the U.S. alone. ",['SDG_12'],['SDG_12'],['SDG_12'],-0.4019
5126,page 65 of ../pdf/generalmills.pdf,"(335.0097351074219, 304.4219055175781, 438.2674560546875, 373.10589599609375)",27,"During the past four years,  our global investments in  food recovery technology  have empowered more than  30,000 retail and foodservice  locations to participate in  systematic food rescue. ",,,,0.5106
5128,page 65 of ../pdf/generalmills.pdf,"(464.82830810546875, 224.29318237304688, 583.4600219726562, 332.9891052246094)",46,"n   Since 24% of food waste  happens in homes, General  Mills developed and launched  the #tastenotwaste initiative  on bettycrocker.com in 2018  with follow-up campaigns  in 2019 and 2020. These  campaigns provided consumers  with information on food  waste and tips on how to  reduce waste at home. ",['SDG_12'],,['SDG_12'],-0.7845
5129,page 65 of ../pdf/generalmills.pdf,"(464.82830810546875, 338.7931823730469, 570.29296875, 407.47723388671875)",32,"n   General Mills also promotes  Save the Food, a U.S.-based  campaign from the Natural  Resources Defense Council  and the Ad Council that  provides tips on how to  store, cook and save food. ",,,,0.8957
5130,page 65 of ../pdf/generalmills.pdf,"(593.7647094726562, 199.80819702148438, 708.5081176757812, 288.4981384277344)",39,"General Mills and our Foundation  provide philanthropic support to  leading nonprofits that makes it  possible for food manufacturers,  grocers, restaurants, distributors,  trucking companies and  other organizations to donate  surplus food so it can be  distributed to people in need. ",,,,0.4019
5132,page 65 of ../pdf/generalmills.pdf,"(594.21240234375, 338.7931823730469, 709.3517456054688, 407.47723388671875)",31,n   Our investments in Feeding  America’s MealConnect food  recovery platform (more than  US$3 million to date) have  helped recover and charitably  redistribute more than 2 billion  pounds of good surplus food. ,,,,0.6486
5135,page 65 of ../pdf/generalmills.pdf,"(153.8800048828125, 487.706787109375, 387.9668884277344, 546.3878173828125)",70,"In 2020, General Mills committed to the 10x20x30 Initiative with a  pledge of cutting our food waste in half by 2030. The pledge is part  of our collaboration with food retailers and others through Friends of  Champions 12.3, which drives progress toward UN SDG Target 12.3: To  halve per capita global food waste at the retail and consumer levels  and reduce food losses along production and supply chains by 2030. ","['SDG_12', 'SDG_17']",['SDG_12'],"['SDG_17', 'SDG_12']",0.3818
5138,page 65 of ../pdf/generalmills.pdf,"(54.0, 569.2838745117188, 550.6272583007812, 576.5498657226562)",23,*Food waste calculation includes waste generated from production of food for human and pet consumption. Disposal includes landfill and incineration without energy recovery. ,['SDG_12'],['SDG_12'],['SDG_12'],-0.7517
5139,page 65 of ../pdf/generalmills.pdf,"(76.25749969482422, 102.06189727783203, 715.8814697265625, 150.73985290527344)",117,"As a global food company, General Mills believes that food loss and waste* are major environmental and economic challenges that undermine food security, contribute to climate change,  unnecessarily consume natural resources, like water, and add more costs to families, communities and businesses alike. We take a broad approach to addressing food rescue, from reducing  loss in our operations and collaborating across the industry to empowering food businesses in surplus food recovery, educating consumers on how to save food at home and engaging  with communities worldwide. The General Mills Food Waste Action Team – composed of employees from sustainability, philanthropy, supply chain, government affairs and environmental  standards – collaborates to drive progress and identify new opportunities for impact. ","['SDG_4', 'SDG_9', 'SDG_12', 'SDG_13', 'SDG_15']",,"['SDG_4', 'SDG_15', 'SDG_13', 'SDG_12', 'SDG_9']",0.9081
5168,page 66 of ../pdf/generalmills.pdf,"(405.0, 250.0059051513672, 742.960205078125, 266.27191162109375)",37,"*More than 100,000 children reached to date through General Mills support to FRAC and No Kid Hungry. The breakfast  gap, which included 3 million children prior to COVID-19, is expected to grow significantly due to the pandemic. ",['SDG_3'],,['SDG_3'],0.2263
5173,page 66 of ../pdf/generalmills.pdf,"(54.15999984741211, 584.5639038085938, 625.6005859375, 591.8298950195312)",29,"*Grant recipients: Breakfast Club of Canada, No Kid Hungry, Greggs Foundation, ReThink Food, Instituto Melhores Dias, Ação da Cidadania. The US$2.5 million is part of General Mills’ COVID-19 response.  ",,,,-0.296
5176,page 66 of ../pdf/generalmills.pdf,"(68.27999877929688, 314.8418884277344, 706.4766845703125, 333.5108947753906)",51,"When the COVID-19 pandemic led schools to close around the world, we supported our partners in continuing to nourish children outside of schools and provided $2.5 million in additional  child-hunger relief to key partners.* General Mills helps to improve childhood food and nutrition security through our support of the following programs. ","['SDG_2', 'SDG_3']",,"['SDG_2', 'SDG_3']",0.9325
5177,page 66 of ../pdf/generalmills.pdf,"(68.19999694824219, 351.5091247558594, 724.9199829101562, 370.83612060546875)",27,"Brazil: Instituto   Melhores Dias Provides nourishing school meals and holistic school-based  programs reaching 47,800 children.  Provided 3,000 emergency food baskets to 1,000 families enabling approximately 90,000 meals. ",,,,-0.2023
5178,page 66 of ../pdf/generalmills.pdf,"(68.19998168945312, 377.6891174316406, 377.36175537109375, 407.51611328125)",35,"Canada: Breakfast  Club of Canada Leading provider of school breakfast to Canadian children in need.  As of 2020, 250,000 children receive daily access to a nourishing  meal at school in nearly every province and territory.   ",,,,0.0
5179,page 66 of ../pdf/generalmills.pdf,"(401.19696044921875, 377.85009765625, 730.5480346679688, 407.51611328125)",33,"Pivoted to provide food, funding and delivery services to reach families facing food insecurity.  Emergency response fund increased capacity, more than doubling its reach, growing from feeding  250,000 students daily to 683,921 children.  ",,,,-0.34
5180,page 66 of ../pdf/generalmills.pdf,"(68.199951171875, 414.3691101074219, 727.473388671875, 433.69610595703125)",41,China: World Food  Programme (WFP) Provides pre-school programs with daily access to meals that deliver  critical nutrition for early-childhood development. Pivoted engagement and food and nutrition training with school partners to online platforms and  supported schools as they prepared to re-open. ,"['SDG_2', 'SDG_4']",,"['SDG_4', 'SDG_2']",0.5994
5181,page 66 of ../pdf/generalmills.pdf,"(68.199951171875, 440.5491027832031, 384.4248352050781, 470.3760986328125)",26,"India: WFP Supports nutritional fortification of school meals, directly supporting  over 400,000 children; reaches 4 million children with more  nutritious meals each day through technical assistance. ",,,,0.6808
5182,page 66 of ../pdf/generalmills.pdf,"(401.19696044921875, 440.7100830078125, 708.6793823242188, 459.8760986328125)",22,Strengthened government and civil society response to reach those most in need with food  security measures and multilingual awareness campaigns on COVID-19. ,,,,0.6486
5183,page 66 of ../pdf/generalmills.pdf,"(68.199951171875, 477.2290954589844, 383.374755859375, 507.05609130859375)",31,"U.K.: Greggs  Foundation Supports school breakfast clubs in high-poverty schools across the  U.K., enabling over 5,000 students at 74 schools to gain daily access  to a nourishing school breakfast since 2017. ",['SDG_1'],['SDG_9'],"['SDG_1', 'SDG_9']",0.7096
5184,page 66 of ../pdf/generalmills.pdf,"(401.19696044921875, 477.39007568359375, 727.880859375, 496.55609130859375)",25,Supported establishment of an emergency fund that provided 502 school partners with food and  other essential items to meet the needs of children and families. ,,,,-0.0772
5187,page 66 of ../pdf/generalmills.pdf,"(153.6979522705078, 536.9110717773438, 373.9668273925781, 566.7380981445312)",24,"No Kid Hungry: Expands school breakfast programs in areas with  greatest need and opportunity to increase participation reaching  more than 79,000 students to date.  ",,,,0.8519
5188,page 66 of ../pdf/generalmills.pdf,"(401.19696044921875, 513.9090576171875, 736.3142700195312, 543.736083984375)",43,"FRAC: Supported implementation of new Pandemic EBT program, which gave SNAP breakfast/ lunch benefits to families of 30 million children who lost access to free or reduced-price school meals  when schools closed. (EBT – Electronic Benefits Transfer; SNAP – Supplemental Nutrition Assistance Program.) ",['SDG_2'],['SDG_3'],"['SDG_2', 'SDG_3']",0.8176
5189,page 66 of ../pdf/generalmills.pdf,"(401.20001220703125, 547.4085693359375, 714.7232666015625, 577.235595703125)",30,"No Kid Hungry: With support from General Mills Foundation US$1.75 million grant and others,  launched campaign to help schools safely provide more than 847 million meals to children   and families.  ",,,,0.8555
5212,page 67 of ../pdf/generalmills.pdf,"(54.0, 571.203857421875, 458.141357421875, 578.4698486328125)",21,*These efforts complement the collaborative work of our business teams and ingredient suppliers described in the Planet section of this report. ,,,,0.0
5216,page 67 of ../pdf/generalmills.pdf,"(148.47000122070312, 236.65008544921875, 301.5257263183594, 276.81610107421875)",24,"Improve the well-being of 30,000 people  (farmers and their families) by 2030 in  smallholder farming communities from which  General Mills sources cocoa and vanilla. ",,,,0.4404
5219,page 67 of ../pdf/generalmills.pdf,"(427.47601318359375, 236.65008544921875, 718.941650390625, 276.81610107421875)",36,"More than 50,000 smallholder farmers and their family members receive support to  improve their livelihoods and farming practices, empower female farmers, establish  farmer cooperatives, increase food and nutrition security, support youth education and  prevent child labor.  ","['SDG_4', 'SDG_8']",,"['SDG_8', 'SDG_4']",0.9186
5222,page 67 of ../pdf/generalmills.pdf,"(319.4730224609375, 295.67437744140625, 708.322998046875, 314.84039306640625)",24,PUR Project Implemented new cocoa ecosystems and reforestation programs in the Kakum HIA   region of Ghana and the Mont Peko region of Côte d’Ivoire. ,,,,0.0
5224,page 67 of ../pdf/generalmills.pdf,"(148.47000122070312, 351.5882873535156, 285.6000061035156, 391.7543029785156)",24,"Support broad adoption of regenerative  agriculture principles and best practices,  such as no-till farming and the use of  cover crops, to improve soil health. ",,,,0.8689
5226,page 67 of ../pdf/generalmills.pdf,"(427.4700012207031, 351.5882873535156, 715.1953735351562, 381.2543029785156)",35,"n   Identified and measured soil health indicators at over 340 North American sites to  evaluate and better understand the relationship between soil health and changes in  farm yield, farmer economics, water quality and GHG emissions.  ",['SDG_9'],,['SDG_9'],0.4404
5227,page 67 of ../pdf/generalmills.pdf,"(427.4700012207031, 385.0882873535156, 698.6336059570312, 404.2543029785156)",22,n   Supported the launch of a program for the new generation of farmers who are  passionate about soil health and regenerative agriculture. ,,,,0.6908
5233,page 67 of ../pdf/generalmills.pdf,"(427.4700012207031, 451.08819580078125, 719.380859375, 480.75421142578125)",35,"n   Examined and advanced watershed health solutions in regions around the world,  such as the Ganges River in the Indian state of Madhya Pradesh, the Rio Grande river  valley in New Mexico and across California. ",,['SDG_6'],['SDG_6'],0.4019
5235,page 67 of ../pdf/generalmills.pdf,"(148.47000122070312, 492.08807373046875, 307.11798095703125, 532.2540893554688)",24,Support the engagement of farmers to expand  pollinator habitats on and near agricultural  lands and advance cutting-edge research  to protect and restore pollinator health. ,,,,0.8957
5237,page 67 of ../pdf/generalmills.pdf,"(427.4700012207031, 492.08807373046875, 705.20556640625, 511.25408935546875)",21,n   Supported field biologist teams partnering with farmers to establish and expand  pollinator habitats across key agricultural regions in the U.S. ,,,,0.5574
5238,page 67 of ../pdf/generalmills.pdf,"(427.4700012207031, 515.0880737304688, 707.4044799804688, 534.2540893554688)",22,n   Supported leading global research to advance understanding of factors and risks  impacting pollinators and share findings to improve bee population health. ,,,,0.6486
5277,page 68 of ../pdf/generalmills.pdf,"(589.4351806640625, 166.12728881835938, 734.2813110351562, 208.8978729248047)",23,"of our employees worldwide report  volunteering in their communities,  sharing their time and talent in ways  that serve both people and the planet. ",,,,0.6808
5282,page 68 of ../pdf/generalmills.pdf,"(589.61572265625, 492.173828125, 726.8943481445312, 534.9443969726562)",20,in cumulative giving provided by  General Mills and our Foundation to  strengthen communities since our  Foundation was established in 1954* ,,,,0.5719
5287,page 68 of ../pdf/generalmills.pdf,"(589.5001220703125, 544.4038696289062, 716.8565063476562, 578.6698608398438)",20,"*This figure includes General Mills  Foundation grants, Box Tops for Education™  giving, corporate contributions and the  company’s global food donations. ",['SDG_4'],,['SDG_4'],0.765
5288,page 68 of ../pdf/generalmills.pdf,"(229.79647827148438, 262.49188232421875, 560.2942504882812, 348.107177734375)",66,"r In fiscal 2020, more than 200 employees  based throughout the U.S. from our  Convenience Stores and Foodservice  division volunteered at 25 food banks as  part of our Hometown Hunger Heroes  program, lending their time and talent  and augmenting a US$125,000 grant from  General Mills to these food banks. r This video highlights many of the ways we  are helping to increase food security in Canada. ",['SDG_2'],,['SDG_2'],0.91
5291,page 68 of ../pdf/generalmills.pdf,"(81.95999908447266, 392.1339111328125, 522.4406127929688, 411.2999267578125)",32,"Around the world, our employees volunteered more than 8,000 hours during the pandemic (between March 1 and Oct. 31, 2020).  Here are a few ways they made a difference in their communities: ",,,,0.0
5292,page 68 of ../pdf/generalmills.pdf,"(82.0, 523.3719482421875, 222.85879516601562, 559.4406127929688)",24,"r In Brazil, France, India, Spain, the  U.K. and U.S., employees provided food  and supplies to front-line workers and  others affected by the pandemic. ",,,,-0.1531
5294,page 68 of ../pdf/generalmills.pdf,"(392.99603271484375, 523.357421875, 532.8912353515625, 559.4261474609375)",25,"r More than 2,000 employees and  their family members prepared over  1,500 boxes and bags with snacks and  supplies for nonprofits in 40 U.S. states. ",,,,0.2263
5352,page 69 of ../pdf/generalmills.pdf,"(593.918212890625, 133.32229614257812, 743.716796875, 209.08326721191406)",37,"In response to natural disasters, we  provided nearly US$65,000 in financial  and in-kind donations to the Australian  Red Cross, American Red Cross and  WIRES Animal Rescue in charitable  giving contributed by General Mills  worldwide in fiscal 2020.*  ",,,,0.743
